"","pub_date","main","score"
"6728","2015-09-27","Lauren Rooney, Ian Belknap",0
"6729","2015-09-27","Paid Notice: Deaths  LARSON, JACK",-0.2
"6730","2015-09-27","Robin Hemphill, Sally Santen",0
"6731","2015-09-27","Chondita Chatterjee and Alexander Dayton",0
"6732","2015-09-27","Born in the Basement and Never Left",0
"6733","2015-09-27","Russia and Estonia Swap Prisoners Accused of Spying",-0.333333333333333
"6734","2015-09-27","Jeb Bush Opposes Shutdown Over Planned Parenthood Funding; Carly Fiorina Doesn&#8217;t",-0.1
"6735","2015-09-27","To Get a Job in Your 50s, Maintain Friendships in Your 40s",0
"6736","2015-09-27","Thousands Enter Syria to Join ISIS Despite Global Efforts",0.125
"6737","2015-09-27","Brittney Martin and Reeve Schley: A Furniture Designer Meets His Muse",0.125
"6738","2015-09-27","Don't Be So Square",0.5
"6739","2015-09-27","'Black Silent Majority,' by Michael Javen Fortner",0.166666666666667
"6740","2015-09-27","Stop Googling. Let's Talk.",-0.25
"6741","2015-09-27","Paid Notice: Deaths  KULPERGER, ROBERT J.",-0.2
"6742","2015-09-27","David Maraniss's 'Once in a Great City: A Detroit Story'",0.166666666666667
"6743","2015-09-27","Barcelona Loses Lionel Messi 2 Months With Injury",-0.333333333333333
"6744","2015-09-27","Pope Francis Condemns Abuse",-0.5
"6745","2015-09-27","The Post-Boehner Congress and Washington&#8217;s Sense of Dread ",0
"6746","2015-09-27","The Curious Politics of the 'Nudge'",0.333333333333333
"6747","2015-09-27","Restaurant Review: Coming Home to Kelly's Sea Level",0.142857142857143
"6748","2015-09-27","Paid Notice: Deaths  GRANGER, PATRICIA ANNE",-0.166666666666667
"6749","2015-09-27","Paid Notice: Deaths  BLAICHMAN, CESIA",-0.2
"6750","2015-09-27","Baz Luhrmann's Miami Hotel",0
"6751","2015-09-28","1915: Allies Stand Behind Balkans",0.5
"6752","2015-09-28","First Draft Focus: The World&#8217;s Undivided Attention",0.166666666666667
"6753","2015-09-28","Raul Castro Addresses U.N.",0
"6754","2015-09-28","From Cheap Oil to &#8216;#ShellNo&#8217; Protests, a Look at Factors in Shell&#8217;s Arctic Retreat",-0.444444444444444
"6755","2015-09-28","India Replaces China as Next Big Frontier for U.S. Tech Companies",0.125
"6756","2015-09-28","Drake and Future Lead a Billboard Chart Featuring Two Versions of &#8216;1989&#8217;",0.125
"6757","2015-09-28","The Migrant Crisis in Europe: Readers' Questions Answered",-0.333333333333333
"6758","2015-09-28","Selfie With a Talib",0
"6759","2015-09-28","The Blackmail Caucus, a.k.a. the Republican Party",-0.2
"6760","2015-09-28","Sproles Gives Eagles a Lift With Return Touchdown",0.333333333333333
"6761","2015-09-28","Q. and A.: Eugenio B. Bito-onon Jr. on China&#8217;s Island Expansion",0
"6762","2015-09-28","Silicon Valley Lawyer, Gary Reback, Takes Antitrust Fight to Europe",-0.222222222222222
"6763","2015-09-28","Dealing With an Investing Blind Spot",-0.5
"6764","2015-09-28","The Raft Economy: Reporter's Notebook",0
"6765","2015-09-28","Separatists in Catalonia Win Narrow Majority in Regional Elections",0.142857142857143
"6766","2015-09-28","Defining Australian Cuisine at the Sydney Opera House",0
"6767","2015-09-28","A Tug of War Over Art-Sales Transparency",-0.25
"6768","2015-09-28","'Don't Prolong the Pain and Confusion': Readers Respond to an Unusual Divorce",-0.375
"6769","2015-09-28","Luis Severino Pitches Yankees a Step Closer to a Playoff Berth",0
"6770","2015-09-28","News Q&#8217;s | Education Gap Between Rich and Poor Is Growing Wider",0.142857142857143
"6771","2015-09-28","Pope Francis' Remarks to Victims of Sexual Abuse",0
"6772","2015-09-28","Consejos para eliminar las bolsas debajo de los ojos",0
"6773","2015-09-28","The Value of Relationships",0.5
"6774","2015-09-28","Trigger Warnings in College Classes",0
"6775","2015-09-28","Broadway Takes a Hit as a Pope and a Holiday Distract New York",-0.125
"6776","2015-09-29","The Perils of Forcing a Sale of Illiquid Assets",-0.2
"6777","2015-09-29","Afghan President on Retaking Kunduz",0
"6778","2015-09-29","Puerto Rico Officials to Testify on Debt Crisis Before Senate Panel ",-0.125
"6779","2015-09-29","A Gift of Post-Wedding Privacy",0.666666666666667
"6780","2015-09-29","Xi Jinping of China Calls for Cooperation and Partnerships in U.N. Speech  ",0.5
"6781","2015-09-29","Gold on the Yankees Beat: Reporter's Notebook",0
"6782","2015-09-29","Momentum Grows for Jack Dorsey to Be Twitter's Permanent C.E.O.",0
"6783","2015-09-29","Dance This Week: Balanchine Classics, Percussive Feet and Tango",0.285714285714286
"6784","2015-09-29","Review: In 'Elements of Oz,' Smartphones Enhance a Celebration of 'The Wizard of Oz' Film",0.285714285714286
"6785","2015-09-29","Owner of Grand Central Sues Developer and City for $1.1 Billion Over Air Rights",0.222222222222222
"6786","2015-09-29","Giants' Victor Cruz Returns to Practice",0.4
"6787","2015-09-29","Top Scott Walker Fund-Raiser Enlists With Jeb Bush",0
"6788","2015-09-29","Nationals' Jonathan Papelbon Suspended for Fight With Bryce Harper",-0.285714285714286
"6789","2015-09-29","Newborn Is Found Dead After Fall From Bronx Building",-0.333333333333333
"6790","2015-09-29","Hotel Owners Looking to Stay Current Put Money in Properties",0
"6791","2015-09-29","Obama Leads Antiterrorism Meeting",0.5
"6792","2015-09-29","Vodafone Ends Talks on a Deal With Liberty Global",0.166666666666667
"6793","2015-09-29","7 New Legionnaires' Cases in Bronx Prompt Investigation",0.166666666666667
"6794","2015-09-29","Iran: Number of Iranians Who Died in Hajj Disaster Is Revised to 226",-0.285714285714286
"6795","2015-09-29","Richard E. Rainwater, Billionaire Texas Dealmaker, Dies at 71",-0.166666666666667
"6796","2015-09-29","Paid Notice: Deaths  BERKOWITZ, LENORE",-0.2
"6797","2015-09-29","Migrants in Germany Fleeing Poverty Find Only a Ticket Home",-0.285714285714286
"6798","2015-09-29","Humans Connect Around Rare Eclipse of the Moon, But Not Our Rare Earth?",0.25
"6799","2015-09-29","Many Conservative Republicans Believe Climate Change Is a Real Threat",0.125
"6800","2015-09-29","Amazon Envisions a New Tech Hub as It Expands Its Detroit Presence",0.125
"6801","2015-09-30","Bills Aim to Protect Renters During Construction Work ",0.333333333333333
"6802","2015-09-30","Police Killing in Delaware Brings Calls for Inquiry",0
"6803","2015-09-30","Brittney Griner to Miss Start of Training Camp",0
"6804","2015-09-30","Doris Salcedo Wins Nasher Prize for Sculpture",0.166666666666667
"6805","2015-09-30","Donald Trump Unleashes Ire at Marco Rubio",0
"6806","2015-09-30","With Its Stock Price Down Over 80%, Cumulus Media Replaces Its Chief Executive",-0.142857142857143
"6807","2015-09-30","Ionel Talpazan, Whose U.F.O. Art Had Sightings All Over, Dies at 60",0
"6808","2015-09-30","The Kurds' Democratic Experiment",0.333333333333333
"6809","2015-09-30","Your Wednesday Briefing",0
"6810","2015-09-30","Paid Notice: Deaths  BAUMAN, HOWARD A.",-0.2
"6811","2015-09-30","Introducing L'Appartement",0
"6812","2015-09-30","36 Hours in Bologna",0
"6813","2015-09-30","Dozens Killed in Clashes in Central African Republic",-0.333333333333333
"6814","2015-09-30","At Dries Van Noten, Artful Layering",0.2
"6815","2015-09-30","Minnesota: Woman Accused of Defacing Office Sign of Hunter ",-0.285714285714286
"6816","2015-09-30","Catherine Coulson, the Enigmatic Log Lady of 'Twin Peaks,' Dies at 71",-0.125
"6817","2015-09-30","What You Get for . $1,295,000",-1
"6818","2015-09-30","Conviction in Death of Peterson's Son",-0.25
"6819","2015-09-30","Knicks Start Practice With a Coach of Fewer Words ",0.166666666666667
"6820","2015-09-30","The Daily Bag: Dries Van Noten",0
"6821","2015-09-30","Houseman",0
"6822","2015-09-30","Google Unveils New Devices to Connect Smartphone and TV",0.166666666666667
"6823","2015-09-30","Saudis Face Mounting Pressure Over Civilian Deaths in Yemen Conflict",-0.25
"6824","2015-09-30","Guardian Industries Settles Allegations It Violated Clean Air Act",0.25
"6825","2015-09-30","What if All Politics Is National?",0.5
"6826","2015-10-01","Robert Curvin, Scholar Who Fought Bias and Poverty in Newark, Dies at 81",-0.375
"6827","2015-10-01","Effectiveness of Talk Therapy Is Overstated, a Study Says",0
"6828","2015-10-01","News Q&#8217;s | Court Rules That College Athletes Will Not Be Paid",0.428571428571429
"6829","2015-10-01","Search Continues for a New Home for the Tony Awards",0.333333333333333
"6830","2015-10-01","CNBC Sets Higher Bar to Enter Next Republican Debate",-0.25
"6831","2015-10-01","Doug Kendall, Liberal Who Challenged Supreme Court's Conservatives, Dies at 51",0.25
"6832","2015-10-01","Murder Case Against Mother Spurs Review of '08 Death of Another Child",-0.25
"6833","2015-10-01","The Most Important Thing, and It's Almost a Secret  ",0
"6834","2015-10-01","Excerpt: 'Polaris'",0
"6835","2015-10-01","Mexico, Signaling Shift, Extradites Drug Kingpins to United States",0.125
"6836","2015-10-01","Mahmoud Abbas, at U.N., Says Palestinians Are No Longer Bound by Oslo Accords",0
"6837","2015-10-01","A World Where There Are Octobers",0
"6838","2015-10-01","Is Planned Parenthood's President Overpaid?",0
"6839","2015-10-01","From Marc Jacobs to Ralph Lauren, the Best Mentors in Fashion",0.428571428571429
"6840","2015-10-01","Paid Notice: Deaths  GLANTZ, ROSE",-0.2
"6841","2015-10-01","Review: 'Northern Soul' Shows '70s England Through a Music Lens",-0.142857142857143
"6842","2015-10-01","Putting Mobile Ad Blockers to the Test",0.25
"6843","2015-10-01","Teenagers in The Times | September 2015",0
"6844","2015-10-01","In Hong Kong, the Watch Debutants",0
"6845","2015-10-01","Leopard Print (and Lots of Sequins) at Lanvin",0
"6846","2015-10-01","What the Oslo Accords Accomplished",0.666666666666667
"6847","2015-10-01","Movie Review: 'He Named Me Malala'",0
"6848","2015-10-01","Paid Notice: Deaths  BARRY, JOHN H.",-0.2
"6849","2015-10-01","Lagarde Predicts Sluggish, Uneven Growth in Global Economy",-0.285714285714286
"6850","2015-10-01","Review: 'This Changes Everything' Sweetly Confronts Climate Change",0
"6851","2015-10-02","What&#8217;s on This Week Around the World",0
"6852","2015-10-02","Review: 'Taken by Storm,' About the Mind Behind a Design",-0.166666666666667
"6853","2015-10-02","Conflicts and Kissinger: A Tale of Two Book Reviews",-0.166666666666667
"6854","2015-10-02","Time-Lapse: Dior Builds a Flower-Covered Mountain at the Louvre",0
"6855","2015-10-02","Mass Shootings in the U.S.",-0.5
"6856","2015-10-02","Hillary Clinton's Authenticity Problem, and Ours",0
"6857","2015-10-02","Deadly Day on an Oregon Campus",-0.25
"6858","2015-10-02","Success Is No Longer Foreign to East Timor, but the Players Are",0
"6859","2015-10-02","Panel: Covering the Globe",0
"6860","2015-10-02","Blue Jays' Title Leaves Buffalo Bills With Longest Playoff Drought",-0.111111111111111
"6861","2015-10-02","Private Probation Company Accused of Abuses in Tennessee",-0.166666666666667
"6862","2015-10-02","Cincinnati Holds Off Miami",0
"6863","2015-10-02","Panel: Inside The Times's Editorial Page",0
"6864","2015-10-02","Kazuo Kitai's Record of a Japan in Transition",0
"6865","2015-10-02","Shares of PJT Partners Decline on Debut",0.2
"6866","2015-10-02","Why Does This Watch Cost $815,000?",-0.5
"6867","2015-10-02","Hurricane Joaquin Air Travel and Cruise Updates",0.166666666666667
"6868","2015-10-02","Judge Allows Class-Action Suit Over Mississippi Prison Conditions",0.142857142857143
"6869","2015-10-02","Loewe: Spring 2016 RTW",0
"6870","2015-10-02","Pope Francis' Secret Meeting With Kim Davis",0
"6871","2015-10-02","Hillary Clinton Accuses Alabama of Curbing Access to Voting",0
"6872","2015-10-02","1890: London&#8217;s Moral Guardians",0.666666666666667
"6873","2015-10-02","27 Ways to Be a Modern Man",0.666666666666667
"6874","2015-10-02","Case That Could Erode Amateur Model Takes a Small Step",-0.142857142857143
"6875","2015-10-02","Jazz Listings for Oct. 2-8",0
"6876","2015-10-03","Helping Desperate Parents",-0.333333333333333
"6877","2015-10-03","The Folly of Big Science Awards",0.25
"6878","2015-10-03","Grim Jobs Report Is Likely to Delay a Move by the Fed on Rates",-0.25
"6879","2015-10-03","Fighting Cancer, but Killed by &#8216;Disease of the Street&#8217; After Stopping a Brawl",-0.714285714285714
"6880","2015-10-03","Venus Williams in Final",0
"6881","2015-10-03","Oregon Killer Described as Man of Few Words, Except on Topic of Guns",-0.25
"6882","2015-10-03","Columbia Sloppy in Loss to Princeton",-0.5
"6883","2015-10-03","Longchamp Revamp Splits French Racing",-0.4
"6884","2015-10-03","The Ethics of Ad Blockers",0.5
"6885","2015-10-03","Human Rights Groups Assail U.N. Panel's Yemen Resolution",0.285714285714286
"6886","2015-10-03","Paid Notice: Deaths  FINAN, FARRELL J.",-0.2
"6887","2015-10-03","Ohio: Police Chief Admonishes Public Over Killings of Children in Cleveland",-0.25
"6888","2015-10-03","Hurricane Joaquin Forecast: Why U.S. Weather Model Has Fallen Behind",0
"6889","2015-10-03","Hillary Clinton Says Coal Company&#8217;s Bankruptcy Plan Hurts Miners",-0.111111111111111
"6890","2015-10-03","Fryar Sentenced to 5 Years",-0.333333333333333
"6891","2015-10-03","Oklahoma Appellate Court Stays Execution for 3 Inmates",0
"6892","2015-10-03","Missouri Inmate Is Spared Death Sentence",-0.2
"6893","2015-10-03","Paid Notice: Deaths  SCHAEFER, AILEEN ROSE MANNIX",-0.142857142857143
"6894","2015-10-03","Cable and Satellite Ads Aim to Revamp the Industry's Image",0.166666666666667
"6895","2015-10-03","Paid Notice: Deaths  ROSENTHAL, RUTH",-0.2
"6896","2015-10-03","Putin's Plan for Syria",0
"6897","2015-10-03","Pardon Edward Snowden",0.333333333333333
"6898","2015-10-03","Changing Tastes in the Turn Away From Soda",0
"6899","2015-10-03","The Pope's Confounding Consistency",0
"6900","2015-10-03","Louisville Inquiry Looks Into Claims of Sex for Recruits",0
"6901","2015-10-04","Joshua Jackson of 'The Affair': An Unlikely Fashion Guy",0.166666666666667
"6902","2015-10-04","Humble Outpost for a Former First-Round Pick",0
"6903","2015-10-04","Pieces of Nature Preserved as Art at the New Jersey State Museum",0.25
"6904","2015-10-04","Finding a Partner for Life's Marathons",0.25
"6905","2015-10-04","Paid Notice: Deaths  GOLDMAN, ROBERT",-0.2
"6906","2015-10-04","What I Love | Audrey Heffernan Meyer and Danny Meyer",0.166666666666667
"6907","2015-10-04","Deaths Draw Attention to Wall Street's Grueling Pace",0
"6908","2015-10-04","Coach With Two Titles Happily Takes a Back Seat",0.142857142857143
"6909","2015-10-04","The Decline of 'Big Soda'",-0.333333333333333
"6910","2015-10-04","How Ned Yost Made the Kansas City Royals Unstoppable",0
"6911","2015-10-04","Corrections: October 4, 2015",0.5
"6912","2015-10-04","'The Gay Revolution,' by Lillian Faderman",0
"6913","2015-10-04","Blaine Rummel, Oscar Galan",0
"6914","2015-10-04","Meet the American Vigilantes Who Are Fighting ISIS",0
"6915","2015-10-04","So What Is Th@ Thing, Anyway?",0
"6916","2015-10-04","Three Outs From a Title, the Rangers Tumble ",0
"6917","2015-10-04","Oregon Gunman's Father Dismayed by Lack of Gun Legislation",-0.285714285714286
"6918","2015-10-04","Jacksonville Jaguars at Indianapolis Colts Preview",0
"6919","2015-10-04","Fighting for the Right to Sell a Smoothie on New York Streets",0
"6920","2015-10-04","Niall Ferguson's 'Kissinger. Volume I. 1923-1968: The Ideal-ist'",0
"6921","2015-10-04","Paid Notice: Deaths  MARKOWITZ, THELMA ""TOBY""",-0.166666666666667
"6922","2015-10-04","Gary Smith of Ciena: Build a Culture on Trust and Respect",0.428571428571429
"6923","2015-10-04","Philadelphia Eagles at Washington Redskins Preview: Kelly's Schemes Not Enough",-0.125
"6924","2015-10-04","The Ben Affleck Scandal Meter",-0.25
"6925","2015-10-04","Penn State Holds Off Army; Navy Eases Past Air Force ",0.111111111111111
"6926","2015-10-05","Stanford Rolls to the Rhythms of David Shaw",0
"6927","2015-10-05","9 Dead in South Carolina Weather",-0.25
"6928","2015-10-05","1890: Revolution in Ticino",-0.5
"6929","2015-10-05","The Biggest Questions Awaiting the Supreme Court",0.2
"6930","2015-10-05","Ai Weiwei Returns to Beijing to Find Listening Devices in His Studio and Home",0.125
"6931","2015-10-05","Bernie Sanders to Appear on &#8216;Ellen DeGeneres Show&#8217; Next Week",-0.25
"6932","2015-10-05","Batmobile to Appear (Zoom!) in Gotham",0
"6933","2015-10-05","South Sudanese in Australia",0
"6934","2015-10-05","Vincenzo Nibali Prevails in Italy",0
"6935","2015-10-05","Calcium Doesn&#8217;t Improve Bone Density, Analysis Finds",0.142857142857143
"6936","2015-10-05","Is the Gun Lobby Still Invincible?",0
"6937","2015-10-05","Watching for the Programming Apocalypse",0.333333333333333
"6938","2015-10-05","Volkswagen Engine-Rigging Scheme Said to Have Begun in 2008",-0.2
"6939","2015-10-05","Ted Cruz, Outsider?",-0.333333333333333
"6940","2015-10-05","News Q&#8217;s | State of Emergency Issued Due to Flooding in South Carolina",0
"6941","2015-10-05","How a New York Accent Can Help You Get Ahead",-0.142857142857143
"6942","2015-10-05","Most of Relativity Media Acquired",0
"6943","2015-10-05","The Daily Bag: Saint Laurent",0.25
"6944","2015-10-05","Review: Claire Chase Explores the Flute's Possibilities",-0.166666666666667
"6945","2015-10-05","Treasury Auctions for the Week of October 5",0
"6946","2015-10-05","Malia Obama's College Pick: Ivies, Liberal Arts or Public University? ",0.111111111111111
"6947","2015-10-05","Attorney General Announces BP Penalties",0
"6948","2015-10-05","U.S. Aims to Put More Pressure on ISIS in Syria",0
"6949","2015-10-05","New Twists for the TV Plot, as Viewer Habits Change",-0.166666666666667
"6950","2015-10-05","Donald Trump Sees a &#8216;Collapse&#8217; in a G.O.P. Campaign Without Him",-0.142857142857143
"6951","2015-10-06","Paid Notice: Deaths  EDEL, WILBUR",-0.2
"6952","2015-10-06","Paid Notice: Deaths  KARLINSKY, BETTE S",-0.2
"6953","2015-10-06","Hillary Clinton Plans a More Humane Approach on Immigration",0.333333333333333
"6954","2015-10-06","Environmentalists Praise Wildlife Measures in Trans-Pacific Trade Pact",0.285714285714286
"6955","2015-10-06","A Shifting Approach to Saving Endangered Species",0.2
"6956","2015-10-06","2nd Victim of Brooklyn Apartment Explosion Is Found",-0.2
"6957","2015-10-06","What Does My Brain Tumor Mean for My Life as a Mother?",-0.2
"6958","2015-10-06","Learning Nothing In Europe",0.333333333333333
"6959","2015-10-06","Nauru Easing Rules at Detention Center for Australia Asylum Seekers",0.125
"6960","2015-10-06","Pope Francis Opens Vatican Meeting on the Family",0.333333333333333
"6961","2015-10-06","S.S. United States",0.5
"6962","2015-10-06","Jury Selection Focuses on Race in Trial of Thabo Sefolosha, Atlanta Hawks Player",0
"6963","2015-10-06","Eugenie Bouchard Retires From Beijing Match",-0.2
"6964","2015-10-06","Your Evening Briefing",0
"6965","2015-10-06","The Daily Shoe: Juan Carlos Obando",0
"6966","2015-10-06","Cuba and U.S. Agree to Work Together to Protect Marine Life",0.285714285714286
"6967","2015-10-06","N.H.L. Bars Sharks Forward for Half the Season for an Illegal Hit",-0.25
"6968","2015-10-06","Dmitri Hvorostovsky, Being Treated for Brain Tumor, Sends Love to Fans",0.25
"6969","2015-10-06","Paid Notice: Deaths  BARRETT, LUCILLE",-0.2
"6970","2015-10-06","Poll Watch: Wide Party Divide Found on the Value of Political Experience",0.222222222222222
"6971","2015-10-06","Some Surprise, and Affirmation, in China After Tu Youyou Receives Nobel Prize",0.285714285714286
"6972","2015-10-06","Former Hong Kong Leader Is Charged With Misconduct",-0.166666666666667
"6973","2015-10-06","Nets Lose at Home",-0.333333333333333
"6974","2015-10-06","&#8216;Scream Queens&#8217; Episode 4 Recap: The Hag of Shady Lane",-0.428571428571429
"6975","2015-10-06","Rhodes and the Balanced Life",0
"6976","2015-10-07","Corrections: October 7, 2015",0.5
"6977","2015-10-07","The Daily Bag: Louis Vuitton",0
"6978","2015-10-07","Putin's Hockey Party for His Birthday",0
"6979","2015-10-07","Supreme Court Sees DirecTV Class Action as Too Big and Too Small",0.25
"6980","2015-10-07","What an ISIS Chemical Strike Did to One Syrian Family",-0.166666666666667
"6981","2015-10-07","A Modern Villa With a Pool Outside Quito",0
"6982","2015-10-07","Mapping as Mexico Opens for Exploration",0.25
"6983","2015-10-07","Playing Smart With Data: Using Sports Analytics to Teach Math",0.375
"6984","2015-10-07","App Smart | For the Change in Season",0.25
"6985","2015-10-07","Review: 'Old Times,' Where the Past Is a Dangerous Place",-0.166666666666667
"6986","2015-10-07","Wildair",0
"6987","2015-10-07","Clip: 'The Assassin'",-0.5
"6988","2015-10-07","Paid Notice: Deaths  WALLAU, ALEX LEE II",-0.166666666666667
"6989","2015-10-07","Paid Notice: Deaths  FRACKMAN, ROBERT",-0.2
"6990","2015-10-07","Giants Take Precautions After Tight End Is Found to Have MRSA ",0.142857142857143
"6991","2015-10-07","Jeb Bush Says Campaign Attacks on Him Are Keeping His Ailing Father Strong",-0.222222222222222
"6992","2015-10-07","Coal, Which Built a Chinese City, Now Threatens to Bury It",-0.285714285714286
"6993","2015-10-07","A Treasury of Artwork in the Subway",0
"6994","2015-10-07","A Sweet Forgetting: Slavery, Sugar and Scotland",0
"6995","2015-10-07","Warner/Chappell Names Jon Platt Its New Chief",0
"6996","2015-10-07","&#8216;Empire&#8217; Recap: A Homecoming Betrayal",-0.25
"6997","2015-10-07","Paid Notice: Memorials  RUBIN, CYNTHIA 05",0
"6998","2015-10-07","Inside One Artist's London Studio, Where Floral Magic Happens",0.125
"6999","2015-10-07","Reflections on the White House Beat",-0.25
"7000","2015-10-07","New &#8216;Bloom County&#8217; Online Comic Strips to Be Collected and Published",0.25
"7001","2015-10-08","Eating Organic Lowers Pesticide Levels in Children",0
"7002","2015-10-08","N.L. Wild-Card Preview: Chicago Cubs vs. Pittsburgh Pirates",0
"7003","2015-10-08","A Newly Renovated London Hotel, an Attraction in Itself",0.4
"7004","2015-10-08","Charter School Leader Has Indicated She's Leaning Against a '17 Campaign",0.142857142857143
"7005","2015-10-08","Physical Therapy Services Should Be Driven by Need",-0.4
"7006","2015-10-08","A Step Toward Justice in the Release of 6,000 Prisoners",0
"7007","2015-10-08","Bubba Watson's Fine Golf Season, in the Shadows",-0.166666666666667
"7008","2015-10-08","'Voices From Chernobyl': An Excerpt",0
"7009","2015-10-08","Sinatra Sounds for Geffen Hall Gala",0.2
"7010","2015-10-08","Review: Schubert, via David Fray, at the Park Avenue Armory",0
"7011","2015-10-08","Smile! Photo Booths Prove You're a Happy Customer",0.285714285714286
"7012","2015-10-08","Russia's Missiles: A Major New Weapon in Syria Conflict",0
"7013","2015-10-08","Washington: Green Card Order Stands ",0.2
"7014","2015-10-08","Review: In 'Sisters' Follies,' Basil Twist Conjures Two Avant-Garde 1915 Benefactors",0.222222222222222
"7015","2015-10-08","Ayatollah Ali Khamenei Warns Against More U.S.-Iran Talks",0
"7016","2015-10-08","California: Climate Change Law Signed ",0.2
"7017","2015-10-08","Flint Officials Are No Longer Saying the Water Is Fine",0
"7018","2015-10-08","Uber Rejects Proposal That Would Legalize Its Service in Brazil&#8217;s Largest City",-0.125
"7019","2015-10-08","The Palestinians and Oslo: An Israeli Response ",0.25
"7020","2015-10-08","The Artist Behind Deer Dana and Its Celebrity T-Shirts",0.166666666666667
"7021","2015-10-08","Doctors Without Borders Calls for Inquiry Into Kunduz Hospital Attack",0.125
"7022","2015-10-08","Prudence Is Folly",0.5
"7023","2015-10-08","Evaluating the Trans-Pacific Partnership Pact",0.25
"7024","2015-10-08","Hotel and Food News: Casual Dining in Paris; Puglia by Bike",0.125
"7025","2015-10-08","Who Is Demna Gvasalia, Balenciaga's New Designer?",0
"7026","2015-10-09","Hillary Clinton's Opportunist Solution!",0.25
"7027","2015-10-09","Nobel Prize Awarded to Tunisian Coalition",0.4
"7028","2015-10-09","Paid Notice: Deaths  TURETSKY, ELIHU",-0.2
"7029","2015-10-09","Ask Well: When Sitting Can Be Good for You",0.4
"7030","2015-10-09","Video Review: Toyota Highlander Hybrid Offers Room and Fuel Economy",0.111111111111111
"7031","2015-10-09","Closing a Hospital, and Fearing for the Future",0
"7032","2015-10-09","Paid Notice: Deaths  LORILLARD, ALICE W.",-0.2
"7033","2015-10-09","Review: Sean Curran Company in a Cross-Cultural Exchange",0.166666666666667
"7034","2015-10-09","California Becomes Latest State to Ban Plastic Microbeads",0.142857142857143
"7035","2015-10-09","Wrestling With Bulls and Animal Rights in India",0
"7036","2015-10-09","Eva Moskowitz, Charter School Champion, Says She Won't Run for Mayor",0
"7037","2015-10-09","Review: John Luther Adams, Lauded and Played at Columbia",0.285714285714286
"7038","2015-10-09","Marco Rubio Campaign Delivers a Mixed Report on Its Latest Fund-Raising",-0.125
"7039","2015-10-09","Companies Backed by Alibaba and Tencent in E-Commerce Venture",0.333333333333333
"7040","2015-10-09","Book Review Podcast: &#8216;Rosemary: The Hidden Kennedy Daughter&#8217;",0
"7041","2015-10-09","An Opportune Moment for Russia&#8217;s Foray Into Syria ",0.4
"7042","2015-10-09","Dell Would Face Major Challenges in EMC Acquisition",0
"7043","2015-10-09","How Hillary Clinton Would Regulate Wall Street",0
"7044","2015-10-09","Stretch Armstrong and Bobbito, Hip-Hop Heralds, Are Saluted in a Film",0.142857142857143
"7045","2015-10-09","The State of Play in Northern Ireland",0.5
"7046","2015-10-09","VW Needs to Come Clean, Now",0.25
"7047","2015-10-09","Review: 'Barbecue,' an Intervention With Love, Insults and Whiskey",-0.166666666666667
"7048","2015-10-09","Terrance Gore, a Regular-Season Afterthought, Reclaims His Key Postseason Role",0.125
"7049","2015-10-09","Putin's Imperial Adventure in Syria",0.25
"7050","2015-10-09","Elusive Summit in Sight, Don Mattingly Is Not Afraid to Fall",-0.142857142857143
"7051","2015-10-10","U.S. Sees FIFA as Victim and Its Leaders as Wrongdoers",0
