"","pub_date","main","score"
"4489","2015-06-29","As Charleston Church Mourns, Biden Adds His Prayers",-0.166666666666667
"4490","2015-06-29","Up, Up and Away!",0
"4491","2015-06-29","Renovation of Brutalist Building in Goshen Can Proceed, Judge Rules",0.125
"4492","2015-06-29","Mets Defeat Reds in Suspended Game, but Take Their Time Doing So",-0.142857142857143
"4493","2015-06-29","Crucial Questions Remain as Iran Nuclear Talks Approach Deadline",0
"4494","2015-06-29","Justin Gatlin Sets Record at Nationals in 200 Meters",0
"4495","2015-06-29","How to Fire-Roast a Fowl",0
"4496","2015-06-29","June 29, 2015 - Pictures of the Day",0
"4497","2015-06-29","Astros&#8217; New Inclination Is to Flatten Their Hill ",0
"4498","2015-06-29","The Pope's Ecological Vow",0
"4499","2015-06-29","State Relaxes an Order Preventing Teachers From Discussing Standardized Tests",0.5
"4500","2015-06-29","Greek Deal Still Possible, Hollande Says",0
"4501","2015-06-30","Your Tuesday Briefing",0
"4502","2015-06-30","Liberals Shouldn't Assume Redistricting Verdict Will Help Them",0.285714285714286
"4503","2015-06-30","1915: Germans Using Wireless Code",0.25
"4504","2015-06-30","21 Broadway Buildings Denied Protection, Prompting Debate on Growth and Preservation",0
"4505","2015-06-30","Don't Diminish Hamilton",0
"4506","2015-06-30","Worried That Fasting Palestinian Prisoner Could Die, Israel Releases Him",-0.428571428571429
"4507","2015-06-30","Ted Cruz Comes to the Defense of Donald Trump",0.166666666666667
"4508","2015-06-30","An Ocean Mystery in the Trillions",0
"4509","2015-06-30","Brash Personality Seen as Chris Christie's Main Asset",0.285714285714286
"4510","2015-06-30","4 Militants Dead After Raid on Home in Eastern Pakistan, Officials Say",-0.25
"4511","2015-06-30","Paid Notice: Deaths  TARTER, FRED B.",-0.2
"4512","2015-06-30","Full Speech: Christie Announces 2016 Bid",0.2
"4513","2015-06-30","Chinese Stocks Fall Into a Bear Market",-0.2
"4514","2015-06-30","Low-Ranked Briton Wins, Surprising Even Himself",0
"4515","2015-06-30","Trade and Workers",0
"4516","2015-06-30","Wilco Tinkers and Experiments at a Festival It&#8217;s Happy to Share",0.666666666666667
"4517","2015-06-30","United Arab Emirates: Woman Gets Death Sentence in Killing of American",-0.444444444444444
"4518","2015-06-30","A British Pop Singer With a Melancholy Bent",-0.2
"4519","2015-06-30","Paid Notice: Deaths  SUTLIFF, RALPH CALVIN",-0.166666666666667
"4520","2015-06-30","1965: Pakistan and India Pull Troops",0
"4521","2015-06-30","Change Comes From the Margins",0
"4522","2015-06-30","Paid Notice: Deaths  AZENBERG, ELINOR SHANBAUM",-0.166666666666667
"4523","2015-06-30","A Scientific Ethical Divide Between China and West",0
"4524","2015-06-30","Why Birds Sound Like Morning People",0.4
"4525","2015-06-30","Loads of Debt: A Global Ailment With Few Cures",-0.2
"4526","2015-07-01","Obama Says U.S. Embassy Will Open in Cuba",0.333333333333333
"4527","2015-07-01","Lufthansa Offers Compensation to Families of Germanwings Crash Victims",0.285714285714286
"4528","2015-07-01","Closing the Central Park Drives",-0.25
"4529","2015-07-01","A Traffic Accident. A Fire. And Then Their Romance Was Really Tested.",-0.166666666666667
"4530","2015-07-01","Anatomy of a Scene | 'Amy'",0
"4531","2015-07-01","Sepp Blatter Won&#8217;t Attend Women&#8217;s World Cup Final",0.125
"4532","2015-07-01","Verbatim: Lindsey Graham and &#8216;Uncle John&#8217; McCain",0
"4533","2015-07-01","On Housing, Signs of Health and Signs of Harm",0
"4534","2015-07-01","Report Shows Widespread Mistreatment by Health Workers During Childbirth",0
"4535","2015-07-01","Paid Notice: Deaths  KOFFMAN, MORLEY",-0.2
"4536","2015-07-01","What Would Thucydides Say About the Crisis in Greece?",-0.25
"4537","2015-07-01","Is Weed the New Almond?",-0.333333333333333
"4538","2015-07-01","Apple Music Makes Debut With D.J. Carrying the Flag",0
"4539","2015-07-01","Apple Music, Spotify and a Guide to Music Streaming Services",0
"4540","2015-07-01","Pope to Address the Humble and the Powerful Alike in a Three-City U.S. Visit",0.142857142857143
"4541","2015-07-01","Maine: Budget Veto Overridden ",0
"4542","2015-07-01","New Envoy for Prison Transfers",-0.25
"4543","2015-07-01","With All Eyes on Greece, Markets Hold Steady",0.4
"4544","2015-07-01","Breaking Benjamin Arrives on Top With Its First No. 1 Album",-0.166666666666667
"4545","2015-07-01","Supreme Court to Hear Challenge to Union Fees",0.166666666666667
"4546","2015-07-01","Painted-Over Murals by Thomas Cole Found in His Former Home",0
"4547","2015-07-01","Corrections: July 1, 2015",0.5
"4548","2015-07-01","ISIS Allies Target Hamas and Energize Gaza Extremists ",0.285714285714286
"4549","2015-07-01","Fire-Roasted Potatoes, Brooklyn Style",0
"4550","2015-07-01","Paid Notice: Deaths  ROSS, BESSIE TOLCHIN",-0.166666666666667
"4551","2015-07-02","Nineties Nostalgia, Just in Time for Independence Day",0.333333333333333
"4552","2015-07-02","Davidson Coach Bob McKillop Gets New York Honor",0
"4553","2015-07-02","Exxon Lumbers Along to Catch Up With Gay Rights",0.166666666666667
"4554","2015-07-02","Iran Nuclear Talks Could Stall Over Access to Scientists and Sites",0.142857142857143
"4555","2015-07-02","Review: 'Terminator Genisys'",0
"4556","2015-07-02","New York Today: A Revolution, Relearned",-0.2
"4557","2015-07-02","Ex-Nazi on Trial in Germany Admits Complicity",0
"4558","2015-07-02","Review: Three New Plays Put Britain's Penchant for the Classics to One Side",0.2
"4559","2015-07-02","Paid Notice: Deaths  BLAKEMAN, GLORIA",-0.2
"4560","2015-07-02","2 Weeks After Charleston Killings, Memorials Still Grow",-0.166666666666667
"4561","2015-07-02","The Difference Between Listening Up and Tuning Out",-0.333333333333333
"4562","2015-07-02","Hillary Clinton, Loudly and Proudly, Taps Into a Vein of Support Among Gay Voters     ",0.3
"4563","2015-07-02","Daily Report: As More Tech Start-Ups Stay Private, So Does the Money",0
"4564","2015-07-02","Review: Evan Thomas&#8217;s &#8216;Being Nixon: A Man Divided,&#8217; a Glossy Biography",0.125
"4565","2015-07-02","Review: In &#8216;Zarafa,&#8217; a Giraffe Journeys in a Hot-Air Balloon",0
"4566","2015-07-02","&#8216;Super PAC&#8217; Raises $15.6 Million for Hillary Clinton Campaign",0
"4567","2015-07-02","A Mac-to-iPhone Handoff",0
"4568","2015-07-02","Shopping Events and Sales Happening This Week in New York",0
"4569","2015-07-02","Deepwater Horizon Oil Spill: An Interactive Look at What Happened",-0.142857142857143
"4570","2015-07-02","As More Tech Start-Ups Stay Private, So Does the Money",0
"4571","2015-07-02","Acceptance of Christians",0.5
"4572","2015-07-02","Makers of Custom Sneakers Cash In on Desire for One-of-a-Kind Goods",0.142857142857143
"4573","2015-07-02","Obama and Scott Walker Set Aside Political Tensions on the Tarmac",0
"4574","2015-07-02","Court Rejects Investor's Move to Disrupt Samsung Merger",-0.142857142857143
"4575","2015-07-02","Stocks End Higher, Reflecting Hope for a Greek Resolution",0.285714285714286
"4576","2015-07-03","Hopeful Start to Greek Debt Negotiations Quickly Soured",0.142857142857143
"4577","2015-07-03","Bangladesh Police Arrest 12 Men Suspected of Qaeda Ties",-0.142857142857143
"4578","2015-07-03","Review: Roger Brown, 'Political Paintings' and 'Virtual Still Life'",0.125
"4579","2015-07-03","White House Orders Review of Rules for Genetically Modified Crops",0
"4580","2015-07-03","Centene to Acquire Its Managed Care Rival Health Net for $6.8 Billion",0.25
"4581","2015-07-03","Attorney General Ken Paxton of Texas May Face Securities-Fraud Indictment",-0.111111111111111
"4582","2015-07-03","Pop, Rock &amp; Cabaret Listings for July 3-9",0
"4583","2015-07-03","Meghan Trainor Puts Off Shows Because of Vocal Cord Problem",-0.285714285714286
"4584","2015-07-03","An Immigrant&#8217;s Story, Discovered in Discarded Papers",0
"4585","2015-07-03","Indonesia Plane Crash Caused by Engine Failure, Air Force Chief Says",-0.2
"4586","2015-07-03","Fiat Chrysler Accused of Neglect in 23 Recalls",-0.4
"4587","2015-07-03","Review: Jake Gyllenhaal Sings in 'Little Shop of Horrors'",-0.142857142857143
"4588","2015-07-03","&#8216;The Hunger Games: The Exhibition&#8217; Allows Kids to Express Their Inner Katniss",0.25
"4589","2015-07-03","Driving the South's Flag Divide",-0.5
"4590","2015-07-03","What&#8217;s on This Week Around the World",0
"4591","2015-07-03","Aetna Said to Be Near Deal to Buy Humana for $34 Billion",0.142857142857143
"4592","2015-07-03","Charls Walker, Treasury Official and Business Lobbyist, Is Dead at 91",-0.142857142857143
"4593","2015-07-03","A Plan to Resettle Hong Kongers in Northern Ireland? Surely You Jest",0.125
"4594","2015-07-03","Dance Listings for July 3-9",0.333333333333333
"4595","2015-07-03","Capri Social Club in Brooklyn Is a Bar So Ordinary, It's a Star",-0.285714285714286
"4596","2015-07-03","Glenn Ford, Death Row Prisoner Freed After 29 Years, Dies at 65",-0.375
"4597","2015-07-03","Chris Duvall to Miss Three to Four Months",-0.166666666666667
"4598","2015-07-03","Jeb Bush Tax Returns Recall Old Days of Shelters",0.125
"4599","2015-07-03","Summer Reading Contest, Week 4 | What Interested You Most in The Times This Week?",0.142857142857143
"4600","2015-07-03","Prince Removes Music From Most Subscription Streaming Services",0
"4601","2015-07-04","Doctors Without Borders Hospital Raided in Afghanistan",0
"4602","2015-07-04","A Crime's Details Are Rehashed and Parole Is Denied, Again and Again",-0.4
"4603","2015-07-04","Paid Notice: Deaths  HELMAN, GILBERT",-0.2
"4604","2015-07-04","As Bar Codes Replace Tickets, Something Is Lost Before the First Pitch",-0.25
"4605","2015-07-04","France: Surrogate Children Win Legal Recognition",0.166666666666667
"4606","2015-07-04","&#8216;Collecting Paradise&#8217; at the Rubin: A Curious Case of Divergence",0.166666666666667
"4607","2015-07-04","At Art Auctions, Missed Expectations for Some Big Names",0
"4608","2015-07-04","No, Puerto Rico Isn&#8217;t Greece",0
"4609","2015-07-04","Mets&#8217; Noah Syndergaard Stares Down Clayton Kershaw and the Dodgers",0
"4610","2015-07-04","Tie Atop Greenbrier Leaderboard",0
"4611","2015-07-04","Max Mosley on His Life in the Fast Lane",0
"4612","2015-07-04","Wimbledon Players Who Are Mothers Welcome Change in Focus",0.166666666666667
"4613","2015-07-04","U.N. Envoy Draws on Her Past in Sierra Leone to Help Abused Women",-0.125
"4614","2015-07-04","Bubba Watson Will Paint Over Confederate Flag on 'Dukes of Hazzard' Car",0.222222222222222
"4615","2015-07-04","Variety: Cryptic Crossword Puzzle",0
"4616","2015-07-04","Pegasus, a Tugboat and Floating Museum, Hits Rough Waters",-0.142857142857143
"4617","2015-07-04","Town That Chased Away Starbucks Sees Its Identity Being Endangered Again",-0.285714285714286
"4618","2015-07-04","French President Denies Julian Assange's Request for Protection",0
"4619","2015-07-04","&#8216;Operation Wild&#8217; and &#8216;Dr. Jeff&#8217; Show Two Approaches to Veterinary TV",-0.142857142857143
"4620","2015-07-04","Hawaii: Flight in Solar Plane Breaks Record",-0.166666666666667
"4621","2015-07-04","As Referendum Looms, Greece's Tourism Industry Holds Its Breath",0
"4622","2015-07-04","Greece's Sorry Reckoning",-0.333333333333333
"4623","2015-07-04","Protesters Challenge Hillary Clinton During Parade in New Hampshire",-0.285714285714286
"4624","2015-07-04","Conflict Over Lars Boom's Blood Test Result",0
"4625","2015-07-04","Heather Watson's Memorable Defeat at Wimbledon Packs a Sting",-0.142857142857143
"4626","2015-07-05","Lukas Podolski Joins Galatasary",0.25
"4627","2015-07-05","Visita del Papa Francisco pone a prueba su influencia sobre los catolicos en America Latina",0
"4628","2015-07-05","William Styron's 'My Generation: Collected Nonfiction'",0.2
"4629","2015-07-05","The Science of 'Inside Out'",0
"4630","2015-07-05","Packers' Andrew Quarless Arrested",0
"4631","2015-07-05","Lisa Sheridan,  Alexander Tarshis",0
"4632","2015-07-05","Rebecca Rabinowitz, Shai Akabas",0
"4633","2015-07-05","When It Comes to My Son, I&#8217;m a Better Spectator Than Coach",0.4
"4634","2015-07-05","Atelier Versace: Fall 2015 Couture",-0.25
"4635","2015-07-05","Paid Notice: Memorials  LYNCH, DEEGAN, MARGARET (PEG) AGE 94 PASSED ON JUNE 30TH. BELOVED WIFE OF THE LATE JOSEPH F LYNCH, LOVING MOTHER OF HER LATE SON MICHAEL W LYNCH AND SURVIVED BY HER LOVING AND CARING DAUGHTERS CAROL M LYNCH AND MAUREEN S MURPHY AND HER SON, IN, LAW CORNELIUS D MURPHY. ALSO SURVIVED BY HER LOVING SISTER CATHERINE HENNING AND NIECES AND NEPHEWS. VISITATION TUESDAY, JULY 7, 2PM TO 7PM AT FRANK E CAMPBELL FUNERAL HOME, 81ST AND MADISON AVE. FUNERAL MASS AT ST JOHN THE EVANGELIST, 55TH ST. AND FIRST AVE. AT 10:30AM ON WEDNESDAY, JULY 8TH. 1",0.155172413793103
"4636","2015-07-05","Homes for Sale in Brooklyn and Manhattan",0
"4637","2015-07-05","Paid Notice: Deaths  MILLER, IRENE D.",-0.2
"4638","2015-07-05","Tide Suddenly Turns Against Second-Seeded Petra Kvitova",-0.166666666666667
"4639","2015-07-05","Bill Cunningham | Casual Cool",0
"4640","2015-07-05","Mark Teixeira's Resurgence as a Leader Is All in the Finally Healthy Wrist",0.142857142857143
"4641","2015-07-05","Predators Add Cody Bass",0
"4642","2015-07-05","Morningside Heights, More Than a 'College Town'",0
"4643","2015-07-05","A Disney World Vacation in One Day",0
"4644","2015-07-05","The Polaroid Swinger: Changing the Market in an Instant",0
"4645","2015-07-05","Syria Forces and Hezbollah Attack Insurgents Near Lebanon",-0.285714285714286
"4646","2015-07-05","In Machu Picchu's Shadow, Peru's Lake Titicaca Offers Natural Beauty",0.222222222222222
"4647","2015-07-05","Emily Lawrence and Ari Rasekh",0
"4648","2015-07-05","Women's World Cup Final: Jill Ellis, a Serene and Innovative Tactician, Leads the U.S.",0.3
"4649","2015-07-05","Paid Notice: Deaths  FORSTENZER, PETER",-0.2
"4650","2015-07-05","Lisa Dacey,  Jennifer Snook",0
"4651","2015-07-06","ComiXology Expands Digital Library With French Titles",0
"4652","2015-07-06","1901: The Wreck of the Lusitania",-0.5
"4653","2015-07-06","Today in Politics: Gaps Remain as Deadline Nears on Iran Deal",0.125
"4654","2015-07-06","U.S. Export-Import Bank Teetering on Edge",-0.25
"4655","2015-07-06","Unesco Remembers the Alamo",0
"4656","2015-07-06","Shopping for Homegrown Wares in Zagreb",0
"4657","2015-07-06","Manhunt Over and Patrols Gone, Calm and Quiet Return to Dannemora",0.285714285714286
"4658","2015-07-06","Paid Notice: Deaths  SOFAER, MOZELLE EPHRAIM EZEKIEL",-0.142857142857143
"4659","2015-07-06","Misty Copeland of American Ballet Theater to Join &#8216;On the Town&#8217;",0.142857142857143
"4660","2015-07-06","Treasury Auctions Set for the Week of July 6",0
"4661","2015-07-06","Pow! Gay Comic Book Characters Zap Stereotypes ",0.285714285714286
"4662","2015-07-06","At Least 7 Killed in Chicago Shootings",-0.5
"4663","2015-07-06","What&#8217;s on TV Monday",0
"4664","2015-07-06","Delusions of Control",-0.5
"4665","2015-07-06","Vanessa Williams Weds Jim Skrip, Her Third Marriage",0.142857142857143
"4666","2015-07-06","U.S. Team Reacts After World Cup Win",0
"4667","2015-07-06","Metrosophy: Philosophy and the City",0
"4668","2015-07-06","Paid Notice: Deaths  BROOK, JONATHAN EDWARD",-0.166666666666667
"4669","2015-07-06","Drought Sends U.S. Water Agency Back to Drawing Board",0
"4670","2015-07-06","When the President Decided to Sing &#8216;Amazing Grace&#8217;",0.4
"4671","2015-07-06","Photo Diary: Christian Dior Fall/Winter 2015 Couture",0
"4672","2015-07-06","World Law and Politics",0.666666666666667
"4673","2015-07-06","Sean Baker Talks &#8216;Tangerine,&#8217; and Making a Movie With an iPhone",0
"4674","2015-07-06","Nonprofit Group Tied to Marco Rubio Raises Millions While Shielding Donors",0
"4675","2015-07-06","Quotation of the Day",0
"4676","2015-07-07","Of Drought and Man in the West",0
"4677","2015-07-07","Intersection | Santiago, Chile",0
"4678","2015-07-07","Stephen Cutler, JPMorgan's General Counsel, to Become Vice Chairman",0
"4679","2015-07-07","New 'Sophisticated' Oreos Get Permanent Spot in Stores",-0.142857142857143
"4680","2015-07-07","Women's World Cup Final Was Most-Watched Soccer Game in United States History",0.2
"4681","2015-07-07","The Eisenhower Memorial",0
"4682","2015-07-07","John Weinberg, Scion of Goldman, Is Retiring",-0.2
"4683","2015-07-07","Remnant of Boston's Brutal Winter Threatens to Outlast Summer",-0.285714285714286
"4684","2015-07-07","As Israelis Are Tried in a Palestinian's Murder, Agonizing Intimacy in Court",-0.142857142857143
"4685","2015-07-07","Morning Agenda: Cracks Appear in Europe&#8217;s Stance on Greece",0
"4686","2015-07-07","Arms Embargo Takes on Larger Meaning as Iran Nuclear Talks Enter Endgame",-0.1
"4687","2015-07-07","Photo Diary: Chanel Fall/Winter 2015 Couture",0
"4688","2015-07-07","The All Blacks Are Coming, and It's a Red-Letter Day in Samoa",0.2
"4689","2015-07-07","U.S. Women&#8217;s Soccer Win Draws Big Sales on Mobile Devices",0.125
"4690","2015-07-07","The Age of Super PACs",0.333333333333333
"4691","2015-07-07","Tuesday's Travel News and Tips",0.25
"4692","2015-07-07","Paid Notice: Deaths  TAMBOR, BERTHA",-0.2
"4693","2015-07-07","Fernando Caruncho&#8217;s Shock Waves",-0.25
"4694","2015-07-07","Reds Beat Nationals; No Derby for Bryce Harper",-0.166666666666667
"4695","2015-07-07","March 30, 1930: Pluto Is Discovered",0
"4696","2015-07-07","Feeding Syrian Children",0
"4697","2015-07-07","Letters to the Editor",0
"4698","2015-07-07","What We&#8217;re Reading",0
"4699","2015-07-07","Greek 'No' May Have Its Roots in Heroic Myths and Real Resistance",0.142857142857143
"4700","2015-07-07","Francisco resalto la importancia de la familia en su primera misa en Ecuador",0
"4701","2015-07-08","S.C. House Debate Confederate Flag",0
"4702","2015-07-08","Pope Francis, in Ecuador, Calls for More Protection of Rain Forest and Its People",0.25
"4703","2015-07-08","'Complicated' Support for Confederate Flag in White South",0.166666666666667
"4704","2015-07-08","Bill Cosby Admission About Quaaludes Offers Accusers Vindication",0
"4705","2015-07-08","36 Hours in Vilnius",0
"4706","2015-07-08","Paid Notice: Deaths  SCHNEIDER, BERNARD G.",-0.2
"4707","2015-07-08","Review: &#8216;The Tempest&#8217; Brings Music and Spirits to Marcus Garvey Park",-0.125
"4708","2015-07-08","From Didier Ludot, Vintage Chic",0.25
"4709","2015-07-08","Paid Notice: Deaths  MARCUS, JAMES S",-0.2
"4710","2015-07-08","The Case for New Hudson River Rail Tunnels",0
"4711","2015-07-08","Quip Builds for Computing Everywhere",0
"4712","2015-07-08","Alaska: Equipment Needed for Arctic Drilling Is Delayed",-0.333333333333333
"4713","2015-07-08","At Wimbledon, Most of the Serving Is Done Behind the Scenes",-0.2
"4714","2015-07-08","Policy Lessons From The Eurodebacle",0
"4715","2015-07-08","Republicans Aim to Hamper Obama's Policies With Spending Bills",-0.142857142857143
"4716","2015-07-08","Daily Report: Microsoft to Cut Up to 7,800 Jobs, Mostly in Phones Unit",-0.125
"4717","2015-07-08","Bally's Collaboration With the Rapper J. Cole",0.25
"4718","2015-07-08","Paid Notice: Deaths  BARTONE, RICHARD CHARLES",-0.166666666666667
"4719","2015-07-08","Men's Shaving Start-Up Raises $75.6 Million",-0.2
"4720","2015-07-08","Your Wednesday Briefing",0
"4721","2015-07-08","Somali Militants Carry Out Deadly Attack in Northeast Kenya",-0.285714285714286
"4722","2015-07-08","Argentina's Debt",0
"4723","2015-07-08","Steel-Pan Bands in Brooklyn Struggle to Find Rehearsal Space",-0.142857142857143
"4724","2015-07-08","Law Firm Mergers Record Highest Midyear Number",0.285714285714286
"4725","2015-07-08","Comentario: Obama pacta con el diablo por Cuba",0
"4726","2015-07-09","The Greek Reckoning: Nearly Everyone Is to Blame",-0.2
"4727","2015-07-09","Review: Positions Wanted by Minions Experienced at Serving Evildoers",0
"4728","2015-07-09","Review: Looking Inward in Poetry Books From Ron Padgett and Nick Flynn",0
"4729","2015-07-09","I.R.S. Cracks Down on Hedge Fund Tax Strategy",-0.4
"4730","2015-07-09","Oratory on Confederate Flag in South Carolina Legislature Shows Deep Divisions",-0.111111111111111
"4731","2015-07-09","Bad Math and a Coming Public Pension Crisis ",-0.166666666666667
"4732","2015-07-09","New York Today: A Confetti Primer",0
"4733","2015-07-09","Was Donald Trump Right About Immigrant Sanctuary Laws?",0.5
"4734","2015-07-09","Your Evening Briefing",0
"4735","2015-07-09","Facebook Gives Users More Control Over Their News Feeds",0.166666666666667
"4736","2015-07-09","N.F.L. and Tottenham Reach Deal to Play at New Stadium in London",0.125
"4737","2015-07-09","Fashion Blogger Who Claimed Tie to Johnny Depp Accepts Plea Deal",0.222222222222222
"4738","2015-07-09","U.S. Budget Deficit Is Down $52 Billion, C.B.O. Says ",-0.2
"4739","2015-07-09","What&#8217;s On TV Thursday",0
"4740","2015-07-09","Willie Nelson Named Winner of Gershwin Prize by Library of Congress",0.125
"4741","2015-07-09","Jeb Bush and Hillary Clinton Spar Over Worker Hours",0
"4742","2015-07-09","Limiting the Use of Antisatellite Weapons in Space",0
"4743","2015-07-09","Photo Diary: Valentino Fall/Winter 2015 Couture",0
"4744","2015-07-09","Study Finds Low Incomes Constrain Half of World",-0.428571428571429
"4745","2015-07-09","Berlusconi Is Convicted in Graft Case",0
"4746","2015-07-09","Amtrak Is Urged to Install Cameras to Monitor Engineers",0
"4747","2015-07-09","What the Hispanic Vote Says About Bernie Sanders's Chances",0
"4748","2015-07-09","K.K.R. Raises $3.1 Billion to Invest in Road and Other Infrastructure Projects",-0.142857142857143
"4749","2015-07-09","Invoking Charleston Victims in Confederate Flag Debate",0
"4750","2015-07-09","Review: On &#8216;Communion,&#8217; Years &amp; Years Turns the Familiar Into Something of Its Own",0.125
"4751","2015-07-10","The Weekly Health Quiz: Screen Addiction, Bullies and Love Life",0.125
"4752","2015-07-10","Review: &#8216;What We Did on Our Holiday&#8217; Transfers Sitcom Formula to the Big Screen",0
"4753","2015-07-10","Comedy Listings for July 10-16",0.333333333333333
"4754","2015-07-10","Settlement Over Anti-Semitic Bullying at Pine Bush Central Schools Is Approved",0.125
"4755","2015-07-10","Obesity Clinics and the Health Law",0.5
"4756","2015-07-10","Review: National Ballet of China Brings &#8216;Peony Pavilion&#8217; to Lincoln Center",0
"4757","2015-07-10","Comic-Con 2015: Why the Convention Stayed in San Diego",0
"4758","2015-07-10","Paid Notice: Memorials  GOLDIN, ERIC",0
"4759","2015-07-10","Pictures of the Week: The Fourth of July and More",0
"4760","2015-07-10","Crash Forces Leader, Tony Martin, Out of Tour de France",-0.142857142857143
"4761","2015-07-10","Carnegie Museum to Open a Survey of the Designer Peter Muller-Munk",0.142857142857143
"4762","2015-07-10","Hold the Phone, It's Patti LuPone",0
"4763","2015-07-10","Crowd Asks for More on &#8216;Game of Thrones,&#8217; but Cast Says No",0.166666666666667
"4764","2015-07-10","An Uber I.P.O. Looms, and Suddenly Bankers Are Using Uber. Coincidence?",0.125
"4765","2015-07-10","Kristaps Porzingis, Knicks' Top Draft Pick, Is Set for Summer League Debut",-0.1
"4766","2015-07-10","Charles Johnson Discusses &#8216;Middle Passage&#8217; at 25",0.2
"4767","2015-07-10","Review: In &#8216;Strangerland,&#8217; Relocating Does Little to Ease a Family&#8217;s Strains",0
"4768","2015-07-10","Video Review: BMW i8 Is a Futuristic Hybrid That Drives Like a Rocket",0
"4769","2015-07-10","How to Throw a Clambake Like You&#8217;re From Rhode Island",0
"4770","2015-07-10","Bill Clinton&#8217;s Candid Views of the Political Press",0.166666666666667
"4771","2015-07-10","Paid Notice: Deaths  WEIL, GERTRUDE",-0.2
"4772","2015-07-10","Crowning Glory",0.5
"4773","2015-07-10","In Impassioned Debate on South Carolina Confederate Flag, Three Voices Emerge",-0.222222222222222
"4774","2015-07-10","Your Evening Briefing",0
"4775","2015-07-10","Robert F. Kennedy Jr., on Mercury in Vaccines",0
"4776","2015-07-11","Shabab Militants Strike 2 Hotels in Somalia",-0.2
"4777","2015-07-11","Kyle Larson on Pole After Rain",0
"4778","2015-07-11","Women on Bikes, With Helmets",0
"4779","2015-07-11","Malaysia's Critics Fear U.S. May Ease Stance on Trafficking",-0.142857142857143
"4780","2015-07-11","Paid Notice: Deaths  NEWMAN, RONALD",-0.2
"4781","2015-07-11","Paid Notice: Deaths  SAFRAN, ADELE ROLFE",-0.166666666666667
"4782","2015-07-11","In First Chapter of Harper Lee's 'Go Set a Watchman,' Sprouts With Deep Roots",-0.111111111111111
"4783","2015-07-11","Frank Lampard Sidelined With Calf Injury",0
"4784","2015-07-11","LeBron James Signs 2-Year Deal",0
"4785","2015-07-11","Memorandum on New York Ammunition Checks",0
"4786","2015-07-11","Paid Notice: Deaths  NEWMAN, RONNIE",-0.2
"4787","2015-07-11","U.S. Chamber of Commerce: We Don't Support Smoking",0.2
"4788","2015-07-11","Start Again",0
"4789","2015-07-11","Cuomo Is Put on Defensive by Fellow Democrats Over His Style",0.166666666666667
"4790","2015-07-11","Psychologists Who Greenlighted Torture",-0.333333333333333
"4791","2015-07-11","Era Ends as South Carolina Lowers Confederate Flag",0
"4792","2015-07-11","Bernie Sanders Courts Martha&#8217;s Vineyard Donors",0.166666666666667
"4793","2015-07-11","Son of Mezz Mezzrow Finds His Father's Legacy Lives in a Jazz Club in the Village",0
"4794","2015-07-11","&#8216;The Strain&#8217; Rolls Out Season 2 of Its Vampire Invasion Tale",-0.166666666666667
"4795","2015-07-11","Court Limits California's Power to Punish Farmers in Drought",-0.285714285714286
"4796","2015-07-11","Paid Notice: Deaths  WATTERS, JACK",-0.2
"4797","2015-07-11","Iran Opens Campaign to Lay Blame on U.S. if Nuclear Talks Fail",-0.25
"4798","2015-07-11","It's Not the Hours We Work, but the Energy We Put Into Them",0
"4799","2015-07-11","Stampede in Bangladesh Kills at Least 23 at Clothing Handout",-0.166666666666667
