"","pub_date","main","score"
"2271","2015-04-01","Charter's Deal May Not Be the Last Word on Bright House",0.142857142857143
"2272","2015-04-01","Review: 'The Lizzie Borden Chronicles,' a Lifetime Series Starring Christina Ricci",0
"2273","2015-04-01","What Is Morgellons? Singer Joni Mitchell&#8217;s Disputed Diagnosis",-0.166666666666667
"2274","2015-04-01","Paid Notice: Deaths  HOLZER, ROSE",-0.2
"2275","2015-04-01","Getty Grandson, 47, Found Dead Inside His Home",-0.166666666666667
"2276","2015-04-02","Palestinians Join International Criminal Court, but Tread Cautiously at First",0.125
"2277","2015-04-02","Office Space Is Hard to Find for Silicon Valley Newcomers",-0.142857142857143
"2278","2015-04-02","Sydney Leroux and Alex Morgan: Peas in an Exacting Pod",0.142857142857143
"2279","2015-04-02","Musical? Play? All That&#8217;s Sure Is David Bowie Is Involved",0
"2280","2015-04-02","Your Evening Briefing",0
"2281","2015-04-02","When the Politics of &#8216;Religious Freedom&#8217; Divides Families",0.4
"2282","2015-04-02","First Draft Focus: Robert Menendez Goes to Court",0.142857142857143
"2283","2015-04-02","Obama Expands Options for Retaliating Against Foreign Hackers  ",-0.166666666666667
"2284","2015-04-02","Comentario: Acuerdo nuclear con Iran no gira solo en torno a las bombas",0
"2285","2015-04-02","Russia: Scores Die as Trawler Sinks in the Western Pacific",-0.142857142857143
"2286","2015-04-02","For Duke and Kentucky, There's Blue and Then There's Blue",0
"2287","2015-04-02","McDonald's to Raise Pay at Outlets It Operates",0
"2288","2015-04-02","Jonathan Taylor's Accuser Is Arrested",-0.25
"2289","2015-04-02","With Galaxy S6 and S6 Edge, Samsung Tries to Regain Its Footing",-0.333333333333333
"2290","2015-04-02","Criminal Complaint Filed Against Queens Women",-0.4
"2291","2015-04-02","New York State Budget Is Passed Just After Deadline",0.285714285714286
"2292","2015-04-02","In West Hollywood, a Hotel With a Westwood Touch",0
"2293","2015-04-02","Paid Notice: Deaths  WOLF, MARY C",-0.2
"2294","2015-04-02","Review: 'The Forecaster' Traces the Downfall of an Investment Manager",0
"2295","2015-04-02","Review: Alexi Kenney at Weill Recital Hall",0
"2296","2015-04-02","Karl Lagerfeld Brings Chanel's Salzburg to New York",0
"2297","2015-04-02","Thailand: Martial Law Lifted, but Junta Retains a Tight Grip",0.125
"2298","2015-04-02","At Christian Fashion Week, Modesty Is One Policy",0.333333333333333
"2299","2015-04-02","ClassPass: Deep Discounts, but Some Discontent",-0.25
"2300","2015-04-02","Shabazz Napier Out for Season",0
"2301","2015-04-03","Why a Claim About the Irrelevance of Parenting Time Doesn't Add Up",0
"2302","2015-04-03","The New Men's Fragrances, Aggressively Packaged",-0.2
"2303","2015-04-03","I Figured Out How to Tie a Bow Tie, No Thanks to YouTube",0.166666666666667
"2304","2015-04-03","Chanel's Antidote to Megashows",0
"2305","2015-04-03","Paid Notice: Deaths  MARSH, MARIAN (NEE EBNER) ON APRIL 1 MARIAN",-0.111111111111111
"2306","2015-04-03","Going Out on Weekends Is No Longer Just for Amateurs",0.25
"2307","2015-04-03","Everybody Hit Somebody",0
"2308","2015-04-03","Robert Menendez Indictment Points to Corrupting Potential of Super PACs",-0.25
"2309","2015-04-03","The Memory of Catholicism",0
"2310","2015-04-03","Should Grown Men Use Emoji?",0.25
"2311","2015-04-03","Paid Notice: Deaths  POLLACK, ARLENE",-0.2
"2312","2015-04-03","As the Zamboni Idles, N.H.L. Ice Crews Do the Heavy Clearing",0
"2313","2015-04-03","New York City Ballet, Pointe by Pointe",-0.333333333333333
"2314","2015-04-03","Who Owns France's Republican Values?",0.25
"2315","2015-04-03","Paid Notice: Deaths  GLASER, DAVID",-0.2
"2316","2015-04-03","10 Ways to Teach and Learn About Spring (While The Learning Network Is on Vacation)",0.285714285714286
"2317","2015-04-03","New York City Ballet, Pointe by Pointe",-0.333333333333333
"2318","2015-04-03","A Menagerie of Childhood Pets",0
"2319","2015-04-03","Gravehopping: Mel Blanc",0
"2320","2015-04-03","The Grand Waldhaus Hotel",0.333333333333333
"2321","2015-04-03","Shaka Smart to Leave V.C.U. to Coach Texas",0.166666666666667
"2322","2015-04-03","Antitrust and Other Inquiries in Europe Target U.S. Tech Giants",-0.166666666666667
"2323","2015-04-03","'Game of Thrones' Writer George R.R. Martin Posts 'Winds of Winter' Novel Excerpt",0.1
"2324","2015-04-03","In Tunisia, One Brother Studied Philosophy, Another Gunned Down Tourists",-0.125
"2325","2015-04-03","What&#8217;s On This Week Around the World",0
"2326","2015-04-04","With Iran Deal in Hand, White House Makes Sales Pitch to Preserve It",0
"2327","2015-04-04","The Many Droughts of California",-0.333333333333333
"2328","2015-04-04","Paid Notice: Deaths  SNEDAKER, ANNE WOOD",-0.166666666666667
"2329","2015-04-04","Humans of A.C.P.T.",0.5
"2330","2015-04-04","Report Details Flawed Law Enforcement Response to Marathon Bombings",-0.125
"2331","2015-04-04","Arab World Adjusts to Shift in U.S.-Iran Relations",0.166666666666667
"2332","2015-04-04","Virginia: Duke Agrees to Pay $2.5. Million for Ash Spill",0
"2333","2015-04-04","Review: 'Diego Rivera and Frida Kahlo in Detroit'",0
"2334","2015-04-04","Rudolph Perz, Creator of Pillsbury's Doughboy, Dies at 89",-0.166666666666667
"2335","2015-04-04","Sarah Brady, Gun Control Activist, Is Dead at 73",-0.333333333333333
"2336","2015-04-04","McDonald&#8217;s Minimum Raise",-0.333333333333333
"2337","2015-04-04","The Importance of Naming Your Emotions",0.333333333333333
"2338","2015-04-04","A Strength Coach for Wisconsin Uses an App That Works More Than Thumb Muscles",0.125
"2339","2015-04-04","With 50-1 Bet, Casino Owner Sits Two Michigan State Wins From $1 Million",0.111111111111111
"2340","2015-04-04","Stuff We Liked",0.5
"2341","2015-04-04","French Bill Barring Ultrathin Models Clears a Hurdle",0
"2342","2015-04-04","San Francisco Police Officers to Be Dismissed Over Racist Texts",-0.142857142857143
"2343","2015-04-04","Preservationists Fight to Save a Former Asylum in New Jersey",0
"2344","2015-04-04","Alabama Man Freed After Decades on Death Row",-0.166666666666667
"2345","2015-04-04","As Quakes Rattle Oklahoma, Fingers Point to Oil and Gas Industry",-0.125
"2346","2015-04-04","Obama Ventures Into Red States to Pitch His Economic Goals",0.285714285714286
"2347","2015-04-04","An Opportunistic Manhattan Burglar Proves Difficult to Pin Down",-0.333333333333333
"2348","2015-04-04","Review: A Writhing, Emotional Revival of Wagner's 'Tannhauser'",0
"2349","2015-04-04","Jobs Report Sends Government Bond Yields Down",0
"2350","2015-04-04","France: TV Reports on Hostage Taking Prompt Lawsuit and an Investigation",0.142857142857143
"2351","2015-04-05","Iran Will Allow Women in Sports Stadiums, Reversing a Much-Criticized Rule",0.222222222222222
"2352","2015-04-05","After Starting Slowly, L.P.G.A. Veterans Make a Push",-0.166666666666667
"2353","2015-04-05","Cut From the Same Cloth",-0.5
"2354","2015-04-05","Masahiro Tanaka Says His Velocity May Be Lower",-0.166666666666667
"2355","2015-04-05","Why Does She Like Offensive Music? Try Asking",-0.2
"2356","2015-04-05","Paid Notice: Deaths  LAIBE, JOHN 1928, 2015 JOHN WILLIAM LAIBE",-0.125
"2357","2015-04-05","Sentiments and Spaghetti",0
"2358","2015-04-05","Fidel Castro Appears in Public for First Time in 14 Months",0.142857142857143
"2359","2015-04-05","Reading Options for Opening Day",0.5
"2360","2015-04-05","Restaurant Review: Hush Bistro in Farmingdale",0
"2361","2015-04-05","Baritone Luca Salsi Pulls a Leading-Role Double",-0.166666666666667
"2362","2015-04-05","The Trader Who Donates Half His Pay",0.5
"2363","2015-04-05","The Travel Selfie: I Was Here, Give Me a Discount",0.5
"2364","2015-04-05","Rutgers, That Other Unbeaten Team in the 1976 Final Four",0
"2365","2015-04-05","Joan Jonas: All at Once",0
"2366","2015-04-05","Stuffed Animals With an Agenda ",0
"2367","2015-04-05","Editors' Choice",0
"2368","2015-04-05","Paul George Returning to Pacers",0.25
"2369","2015-04-05","Business Owners in Brooklyn Heights Start Subtle Lobbying of Clinton Campaign",0.111111111111111
"2370","2015-04-05","Things to Do in Connecticut, April 5 to 11, 2015",0
"2371","2015-04-05","Aisha Martini and Eduardo Sanchez",0
"2372","2015-04-05","The Cuddly, Fluffy, Surreal World of Angora Show Bunnies",-0.142857142857143
"2373","2015-04-05","James Hannaham's 'Delicious Foods'",0
"2374","2015-04-05","What Obama Would Say to Iranians",0
"2375","2015-04-05","'ISIS: Inside the Army of Terror,' and More",-0.25
"2376","2015-04-06","The Fiscal Future I: The Hyperbolic Case for Bigger Government",0
"2377","2015-04-06","Asian, American, Woman, Philosopher",0
"2378","2015-04-06","Mattia Bonetti&#8217;s Surreal World",0
"2379","2015-04-06","Who&#8217;s Coming to Dinner? Explorers, Astronauts and Spelunkers",0.166666666666667
"2380","2015-04-06","A Mascot With a Fuzzy Future",0
"2381","2015-04-06","Paul George's Long-Awaited Return Electrifies Pacers' Push",0
"2382","2015-04-06","Jeb Bush Listed Himself as &lsquo;Hispanic&rsquo; on Voter Form",0
"2383","2015-04-06","High School Track Athletes Live Out Jamaica's National Passion",0.375
"2384","2015-04-06","Paid Notice: Memorials  GOLD, SIDNEY",0.2
"2385","2015-04-06","Flyers Play Role of Spoiler",0.25
"2386","2015-04-06","Taking a Few Swings as the Season Begins",0
"2387","2015-04-06","Corrections: April 6, 2015",0.5
"2388","2015-04-06","Review: Philip Glass's 'Words Without Music' Tells of a Life Full of Changes in Rhythm",0.0909090909090909
"2389","2015-04-06","The Snake That's Eating Florida",0
"2390","2015-04-06","For Derek Jeter, Retirement Is a Job",-0.25
"2391","2015-04-06","Online Test-Takers Feel Anti-Cheating Software's Uneasy Glare",-0.285714285714286
"2392","2015-04-06","Gloria Steinem and Whoopi Goldberg Join Tribeca Film Festival Juries",0.222222222222222
"2393","2015-04-06","1915: German Ships Reported Sunk",0
"2394","2015-04-06","Beneath California Crops, Groundwater Crisis Grows",-0.166666666666667
"2395","2015-04-06","Fed Minutes, Greek Debt Talks and Samsung Earnings",-0.142857142857143
"2396","2015-04-06","Ad Attacking Rand Paul on Iran Will Coincide With Opening of His Presidential Campaign",0.222222222222222
"2397","2015-04-06","U.S. Allies Flock to Join China's Development Bank",0.333333333333333
"2398","2015-04-06","What We&#8217;re Reading Now",0
"2399","2015-04-06","India Tries Evacuating Citizens in Yemen",-0.2
"2400","2015-04-06","Michigan State&#8217;s Magic Conjures Only So Long ",0.6
"2401","2015-04-07","Paid Notice: Deaths  GOTBAUM, VICTOR",-0.2
"2402","2015-04-07","&#8216;New Girl&#8217; Star Lamorne Morris on Writing This Week&#8217;s Story Line About Race and the Police",-0.0909090909090909
"2403","2015-04-07","Bank of America Merrill Lynch Hires Banker for Equity Capital Markets",0.111111111111111
"2404","2015-04-07","JetBlue to Add Daily Service Between Albany and Florida",-0.166666666666667
"2405","2015-04-07","Victoria Press&#8217;s Blithe Spirit",0.25
"2406","2015-04-07","Paid Notice: Deaths  RABUSHKA, JOSEPH",-0.2
"2407","2015-04-07","Nets, Bouncing Back, Move Closer to the Playoffs ",0.166666666666667
"2408","2015-04-07","Iraq: Crews Start Burial Site Excavation",0
"2409","2015-04-07","3-Month Treasury Bills",0
"2410","2015-04-07","Shelf, iPad, Bed Table: Reading, March 2015",0
"2411","2015-04-07","Skeptical of Iran Nuclear Deal, Israel Calls for Changes",0
"2412","2015-04-07","Paid Notice: Deaths  BRANDT, FREDRIC",-0.2
"2413","2015-04-07","North Carolina: Death Penalty Sought for Students' Killing",-0.142857142857143
"2414","2015-04-07","Earth, the Marvelous Blue Orb",0.25
"2415","2015-04-07","New York City Discriminated in Paying Managers, Commission Finds",0.25
"2416","2015-04-07","Kenyans Try to Trace a Student's Path to Terrorism",-0.333333333333333
"2417","2015-04-07","Sports Groups in Indianapolis Fight to Keep Their City Welcoming",0
"2418","2015-04-07","Paid Notice: Deaths  SIMON, ALLEN H.",-0.2
"2419","2015-04-07","Opening Days Around the World",0.25
"2420","2015-04-07","Paid Notice: Deaths  FRISHTICK, KENNETH",-0.2
"2421","2015-04-07","Liu Xiang, Chinese Olympic Star, Retires",-0.166666666666667
"2422","2015-04-07","Padres Get Craig Kimbrel and Melvin Upton",-0.166666666666667
"2423","2015-04-07","Video Shows Fatal Police Shooting",-0.6
"2424","2015-04-07","Crisis in Palestinian Camp in Syria Has Worsened Since ISIS Invasion, U.N. Says",-0.222222222222222
"2425","2015-04-07","Clic, clac, slurb : La misofonia los vuelve insoportables",0
"2426","2015-04-08","Portraits of People and Paper",0
"2427","2015-04-08","U.S. Coal Leasing Program",0
"2428","2015-04-08","Behind the Poster: &#8216;Switzerland&#8217;",0.333333333333333
"2429","2015-04-08","Will Infighting Help the Republicans in 2016?",0.25
"2430","2015-04-08","At Chevalier, Charles Masson Greets Change",0.2
"2431","2015-04-08","Paid Notice: Deaths  DUBIN, PAULINE",-0.2
"2432","2015-04-08","Paid Notice: Deaths  HANSMANN, RALPH EMIL",-0.166666666666667
"2433","2015-04-08","Paid Notice: Deaths  ANGLIM, PAULE",-0.2
"2434","2015-04-08","Rand Paul Questions the &#8216;Today&#8217; Show Questions",-0.5
"2435","2015-04-08","Royal Dutch Shell in Talks for BG Group, a Gas Producer",-0.142857142857143
"2436","2015-04-08","The Party Is King in Presidential Voting, but a Person Can Make the Difference",-0.125
"2437","2015-04-08"," Golfing Analyst Knows the Thrill and Agony of Wisconsin&#8217;s Season ",0.142857142857143
"2438","2015-04-08","A Short-Lived Power Failure in Washington Causes a Brief Government Shutdown",-0.125
"2439","2015-04-08","Rand Paul on the Issues",0
"2440","2015-04-08","Paid Notice: Deaths  WESTERGAARD, STEADMAN H",-0.2
"2441","2015-04-08","In Rise of Yik Yak App, Profits and Ethics Collide",0.142857142857143
"2442","2015-04-08","Quotation of the Day",0
"2443","2015-04-08","Hawaii: Work on Giant Telescope Is Paused",0
"2444","2015-04-08","The Bull Rider",0
"2445","2015-04-08","Decision on Arab Bank",0
"2446","2015-04-08","James Best, Bumbling Sheriff of 'The Dukes of Hazzard,' Dies at 88",0
"2447","2015-04-08","Make Minestrone Soup Without a Recipe",0
"2448","2015-04-08","Private Profit, Public Gain?",0.5
"2449","2015-04-08","Our Push for &#8216;Passion,&#8217; and Why It Harms Kids",0
"2450","2015-04-08","New York Today: Who&#8217;s That Tapping?",0
"2451","2015-04-09","Derrick Rose Returns to the Bulls' Starting Lineup in a Limited Role",0
"2452","2015-04-09","For Eager Cubans, Big Opening in U.S. Relations Is More Like a Crack",0.428571428571429
"2453","2015-04-09","College Hockey Embraces Its Role as the Marathoner of Winter Sports",0.142857142857143
"2454","2015-04-09","ConocoPhillips Plans to Add Drilling Rigs in Next 3 Years",0
"2455","2015-04-09","Dear Diary: My Week Wearing an Apple Watch",0
"2456","2015-04-09","Arca, Valued Facilitator, Steps Out Front",0.2
"2457","2015-04-09","Wall St. Is Told to Tighten Digital Security of Partners",0.333333333333333
"2458","2015-04-09","Biden Speaks of Progress Against ISIS",0.25
"2459","2015-04-09","Mark Pincus, Zynga's Founder, Returns as C.E.O.",0
"2460","2015-04-09","Paid Notice: Deaths  WANTMAN, CAROL CHREIN",-0.166666666666667
"2461","2015-04-09","1976 | When Cutting-Edge Technology Involved a Rotary Dial",-0.2
"2462","2015-04-09","Paid Notice: Deaths  GREIF, DR",-0.25
"2463","2015-04-09","In California, Cities Braced to Cut Water by 10 to 35%",-0.2
"2464","2015-04-09","Can Nigeria's Former Dictator Become a Democrat?",-0.166666666666667
"2465","2015-04-09","Italian Artisans' Revival After Economic Crisis Reflects Resilience of Small Industry",0.222222222222222
"2466","2015-04-09","Paid Notice: Deaths  WILZIG, NAOMI",-0.2
"2467","2015-04-09","No Netflix &#8216;Crown&#8217; for Helen Mirren",0
"2468","2015-04-09","Explaining the Greek Debt Crisis and What It Means for the Eurozone",-0.333333333333333
"2469","2015-04-09","Your Evening Briefing",0
"2470","2015-04-09","Japan Stands Firm on Stimulus Program",0.4
"2471","2015-04-09","Video Feature: Take On the World With Trivia Game Apps",0.142857142857143
"2472","2015-04-09","Pesticides Linked to Honeybee Deaths Pose More Risks, European Group Says",-0.111111111111111
"2473","2015-04-09","If We Dig Out All Our Fossil Fuels, Here's How Hot We Can Expect It to Get",-0.125
"2474","2015-04-09","Paid Notice: Deaths  GOTBAUM, VICTOR",-0.2
"2475","2015-04-09","Ana Khouri&#8217;s Newest Jewelry Forms - to Accentuate a Woman&#8217;s Own",0.142857142857143
"2476","2015-04-10","Blue Jays&#8217; Early Barrage Sinks Yankees",0
"2477","2015-04-10","U.S. Is Closer to Deciding Cuba's Status on Terror List",-0.166666666666667
"2478","2015-04-10","Morning Agenda: G.E. to Sell Bulk of Finance Unit",0
"2479","2015-04-10","Improving How College Campuses Handle Rape Cases",0.166666666666667
"2480","2015-04-10","U.N. Rights Chief Criticizes Malaysian Antiterror Measure",0.166666666666667
"2481","2015-04-10","Paid Notice: Deaths  BENNET, CARRIE L",-0.2
"2482","2015-04-10","New Video Shows Start of South Carolina Police Conflict as Routine",-0.222222222222222
"2483","2015-04-10","Coachella 2015: And So It Begins, With Drake, Jack White and AC/DC",0
"2484","2015-04-10","With Break-In, Seeking to Change Locks and Leadership at a New York Korean Group",0
"2485","2015-04-10","A Hotel Where Guests Are Pals With the Pen",0
"2486","2015-04-10","Connecting With Iran",0.5
"2487","2015-04-10","Paid Notice: Deaths  NATHAN, VIVIAN",-0.2
"2488","2015-04-10","Oscar Broadcast Set for Feb. 28",0
"2489","2015-04-10","Islanders Fans Prepare for Brooklyn",0
"2490","2015-04-10","The Agony and the Ecstasy of Kanye West",0
"2491","2015-04-10","Georgia Says It Will Allow Hormones for Transgender Inmates",0.285714285714286
"2492","2015-04-10","French Broadcaster TV5 Monde Recovers After Hacking",-0.2
"2493","2015-04-10","1940: British Cheered by Sea News",0.25
"2494","2015-04-10","Anti-Bias Ordinance Falls in Springfield, Missouri, After Push by Christian Conservatives",-0.125
"2495","2015-04-10","'Daily Show' Successor Trevor Noah Finds Himself Catching Criticism, Not Dealing It Out",-0.333333333333333
"2496","2015-04-10","Review: 'Coypel's Don Quixote Tapestries' Weaves a Classic Tale",0.125
"2497","2015-04-10","Founder of Satyam, Software Outsourcing Company in India, Found Guilty of Fraud",-0.222222222222222
"2498","2015-04-10","Paid Notice: Deaths  SELIGMAN, DONALD DAVID",-0.166666666666667
"2499","2015-04-10","Suspect's Mental Ability Is at Fore as Jurors in Patz Trial Prepare to Get Case",-0.1
"2500","2015-04-10","Theater Listings for April 10-16",0
"2501","2015-04-11","State Again Sets Changes for Schools on Climate",0.2
"2502","2015-04-11","5-Year-Old Wins a Grade I",0
"2503","2015-04-11","Underdogs in Semifinals at Family Circle Cup",-0.2
"2504","2015-04-11","Don't Block Remittances to Somalia",-0.25
"2505","2015-04-11","A Murderer at 14, Then a Lifer, Now a Man Pondering a Future",0
"2506","2015-04-11","Longtime G.E. Advisers Tapped Again for Plum Assignment",0.2
"2507","2015-04-11","Paid Notice: Deaths  GOVERNALE, LOUIS M.D.",-0.2
"2508","2015-04-11","Matter Over Mind",0
"2509","2015-04-11","Giants Linebacker Victor Butler Is Suspended",-0.2
"2510","2015-04-11","Paid Notice: Deaths  CONNOR, DR",-0.25
"2511","2015-04-11","Russian Retains World Boxing Association Title",0
"2512","2015-04-11","11 Books About Obsessive Searches",0
"2513","2015-04-11","What's on TV Saturday",0
"2514","2015-04-11","Fund-Raising May Value Spotify Above $8 Billion ",0.2
"2515","2015-04-11","Engaging With Latin America ",0.333333333333333
"2516","2015-04-11","The Young Hopes of Kenya, Laid in the Grave",-0.2
"2517","2015-04-11","China Is Said to Use Powerful New Weapon to Censor Internet  ",0
"2518","2015-04-11","Jim Berk Steps Down as Participant Media's Chief  ",0
"2519","2015-04-11","Paid Notice: Deaths  FINKELSTEIN, MANNY",-0.2
"2520","2015-04-11","G.E. to Retreat From Finance in Post-Crisis Reorganization",-0.25
"2521","2015-04-11","Ivan Doig, Author Who Lived the Western Life, Dies at 75",0.142857142857143
"2522","2015-04-11","Baseball's Eternal Opening Day",0.25
"2523","2015-04-11","Paid Notice: Memorials  GREEN, LINDSAY WAGGENER",0
"2524","2015-04-11","Paid Notice: Deaths  SZOR, LEOPOLD (94) BORN APRIL 4",-0.142857142857143
"2525","2015-04-11","North Charleston Prepares for Mourning and Protest in Walter Scott Shooting",-0.375
"2526","2015-04-12","Paid Notice: Memorials  SHIELDS, MARGARET MCNEELY DIED ON APRIL 5TH 2015 ON HER WAY TO CHURCH FOR EASTER SUNDAY. SHE IS SURVIVED BY HER BELOVED HUSBAND OF 38 YEARS, ROBERT MCCORMICK SHIELDS, JR., HER TWO LOVING CHILDREN, JENNIFER SHIELDS CHRISTOPHER AND VIRGINIA (GINGER) MCCORMICK SHIELDS, AND HER NEW GRANDDAUGHTER, SADIE ELIZABETH CHRISTOPHER. SHE IS ALSO SURVIVED BY HER BROTHER, JOHN WALKER MCNEELY, AND HER SISTER, JOY MCNEELY ENGEL. MARGARET WAS THE MOST LOVING MOTHER, WIFE AND FRIEND ANYONE COULD EVER HOPE FOR. SHE WAS A LIFE LONG NEW YORKER WHO GRADUATED FROM THE NIGHTINGALE, BAMFORD SCHOOL IN 1964 AND A VERY ACTIVE MEMBER OF THE COMMUNITY, SUPPORTING AND VOLUNTEERING AT MANY DIFFERENT ORGANIZATIONS AND CHARITIES INCLUDING THE NEW YORK JUNIOR LEAGUE, THE COLONIAL DAMES OF AMERICA, THE CITY GARDENS CLUB OF NEW YORK AND THE BRIDGE FUND OF NEW YORK. SHE WAS SO ARTISTIC AND CREATIVE, WITH A PASSION FOR FLOWERS AND MAKING JEWELRY. SHE EXUDED WARMTH, KINDNESS AND GENEROSITY TO ALL WHO KNEW HER. WITH HER BEAUTIFUL SMILE AND POSITIVE ATTITUDE SHE WOULD BRING STRENGTH AND HAPPINESS TO ANY SITUATION. SHE TOUCHED THE LIVES OF SO MANY. MARGARET WILL BE DEEPLY MISSED BY ALL. A MEMORIAL SERVICE WILL BE HELD AT 3PM ON MONDAY, APRIL 13 AT THE CHURCH OF THE EPIPHANY, 1393 YORK AVE (CORNER OF 74TH ST), NEW YORK. IN LIEU OF FLOWERS, DONATIONS CAN BE MADE IN MARGARET'S NAME TO THE BRIDGE FUND OF NEW YORK (WWW.THEBRIDGEFUND.ORG) 1",0.182481751824818
"2527","2015-04-12","Literary Louisiana",0
"2528","2015-04-12","Ducks Beat the Coyotes to Lock Up a No. 1 Seed",-0.2
"2529","2015-04-12","Catie Lazarus, Host of 'Employee of the Month,' at Joe's Pub, Holds Court",0.111111111111111
"2530","2015-04-12","Letter of Recommendation: The Gnostic Scriptures",0
"2531","2015-04-12","Paid Notice: Deaths  NILES, ALEX",-0.2
"2532","2015-04-12","'Don't Think I've Forgotten,' a Documentary, Revives Cambodia's Silenced Sounds",0.222222222222222
"2533","2015-04-12","JooHee Yoon's 'Beastly Verse,' and More",-0.25
"2534","2015-04-12","Charles Lloyd, Jazz Master, Questing Still",0.166666666666667
"2535","2015-04-12","Annie Robinson, Andrew Ward",0
"2536","2015-04-12","36 Hours in Antigua, Guatemala",0
"2537","2015-04-12","Nicole Magoon, Jonathan Moran",0
"2538","2015-04-12","Bespoke Living, With Michael Ian Black",0.2
"2539","2015-04-12","Paid Notice: Deaths  REITER, RONALD",-0.2
"2540","2015-04-12","Timothy Fischer and Robert Huber",0
"2541","2015-04-12","Kayla Tausche, Jeffrey Izant",0
"2542","2015-04-12","Stanley I. Kutler, Historian Who Got Nixon Tapes Released, Dies at 80",-0.125
"2543","2015-04-12","Paid Notice: Deaths  JAMISON, JOHN",-0.2
"2544","2015-04-12","A Boyfriend Too Good to Be True",0.666666666666667
"2545","2015-04-12","Nelly Arrested on Drug Charges After Bus Is Stopped",-0.166666666666667
"2546","2015-04-12","Emotions High as Islanders Drop Regular-Season Finale to Blue Jackets",-0.125
"2547","2015-04-12","With New York Real Estate, Just $10 Million Starts to Sound Reasonable",0.444444444444444
"2548","2015-04-12","Hillary Clinton Resigns From Board of Clinton Foundation",-0.166666666666667
"2549","2015-04-12","Paid Notice: Deaths  SIEGEL, SUSAN KARGMAN",-0.166666666666667
"2550","2015-04-12","Editors' Choice",0
"2551","2015-04-13","N.B.A. Game of the Week: Grizzlies at Warriors",0
"2552","2015-04-13","Talks With Cuba Earn U.S. Raves in Latin America",0.166666666666667
"2553","2015-04-13","Review: In Richard Eyre's Production of 'Ghosts,' the Clean Parts Are the Most Disturbing",0.125
"2554","2015-04-13","Housing for the Homeless",0
"2555","2015-04-13","United Finally Solves City, Which Looks Puzzled",0
"2556","2015-04-13","New York Today: Tips for Tax Day",-0.166666666666667
"2557","2015-04-13","In Dispute Over Name, Taiwan Won&#8217;t Join Investment Bank as Founding Member",0
"2558","2015-04-13","Amazon, Google and More Are Drawn to Home Services Market",-0.166666666666667
"2559","2015-04-13","In Etan Patz Trial, Closing Arguments Are Expected to Focus on Confession",-0.25
"2560","2015-04-13","Terrorism Case Renews Debate Over Drone Hits",-0.166666666666667
"2561","2015-04-13","Turmoil Between Political Leaders Has Harmed Bangladesh's People",-0.166666666666667
"2562","2015-04-13","After 8 Shots in North Charleston, Michael Slager Becomes an Officer Scorned",-0.25
"2563","2015-04-13","Review: 'The Driver,' on Acorn TV, Stars David Morrissey",0
"2564","2015-04-13","The Power of Light",0.5
"2565","2015-04-13","At the Helm of a Philanthropist&#8217;s New Los Angeles Museum",0.166666666666667
"2566","2015-04-13","Forgotten Designs From the Memphis Group&#8217;s Founder, Posthumously Produced by Kartell",-0.125
"2567","2015-04-13","Marco Rubio Announces His Candidacy",0
"2568","2015-04-13","Miguel Cabrera's Bat Helps Keep Tigers Unbeaten",0
"2569","2015-04-13","Retailers Scrutinized for Schedules and Staffing",-0.25
"2570","2015-04-13","Review: Shwe Man Thabin at Asia Society",0.166666666666667
"2571","2015-04-13","Derby Honor Belongs to Man United Over City, 4-2",0.333333333333333
"2572","2015-04-13","Wall Street Banks' Mutual Funds Can Lag on Returns",0.125
"2573","2015-04-13","Morbid Anatomy Museum's Taxidermy Classes Offer a Slice of Life (and Death)  ",0
"2574","2015-04-13","JPMorgan and Wells Fargo Earnings; March Retail Sales",0.142857142857143
"2575","2015-04-13","Simple Signal Spurs Complex Process of Fixing Cell Walls",-0.25
"2576","2015-04-14","Sweet and Savory Italian Desserts, the Jody Williams and Rita Sodi Way",0.111111111111111
"2577","2015-04-14","Paid Notice: Memorials  LANIN, MIKE",0
