"","main","kicker","section_name","pub_date"
"58940","Mike Davis, ‘World’s Grumpiest Boss,’ Dies at 85",NA,"Business Day","2016-09-26 04:00:00"
"58941","‘Aviation’s Paris Moment’ as Nations Near Emissions Deal",NA,"Business Day","2016-09-26 04:00:00"
"58945","Treasury Auctions Set for the Week of Sept. 26",NA,"Business Day","2016-09-26 04:00:00"
"58947","Making Video Ads That Work on Facebook’s Silent Screen",NA,"Business Day","2016-09-26 04:00:00"
"58948","‘Brexit’ Prompts Many British C.E.O.s to Consider Relocating, Survey Finds",NA,"Business Day","2016-09-26 04:00:00"
"58953","Ex-A.I.G. Chief Expected to Testify, and House Hearing on Wells Fargo","The Week Ahead","Business Day","2016-09-26 04:00:00"
"58955","What if ‘One Click’ Buying Were Internetwide?",NA,"Business Day","2016-09-26 04:00:00"
"58969","A Moment of Truth for Presidential Debate Moderators","Mediator","Business Day","2016-09-26 04:00:00"
"58977","Jane Pauley to Become Anchor of CBS Show ‘Sunday Morning’",NA,"Business Day","2016-09-26 04:00:00"
"58981","Learning to Allow for Cultural Differences in the Workplace",NA,"Business Day","2016-09-26 04:00:00"
"58984","Snapchat, Known for Ephemera, Proves Its Staying Power With Videos",NA,"Business Day","2016-09-26 04:00:00"
"58985","Yale Endowment Earned 3.4% in a Year When Many Peers Lost",NA,"Business Day","2016-09-26 04:00:00"
"58986","New Snapchat Channel to Look at Final Leg of Presidential Campaign",NA,"Business Day","2016-09-26 04:00:00"
"59082","American Express Can Stop Merchants From Steering Clients to Other Cards",NA,"Business Day","2016-09-27 04:00:00"
"59086","Golf Great Arnold Palmer Was Also a Pioneering Pitchman",NA,"Business Day","2016-09-27 04:00:00"
"59093","Trump’s a Businessman. Where’s His Business Backing?","DealBook","Business Day","2016-09-27 04:00:00"
"59094","Perry Closes Flagship Fund as Clients Flee After Losses",NA,"Business Day","2016-09-27 04:00:00"
"59097","Wells Fargo Workers Claim Retaliation for Playing by the Rules",NA,"Business Day","2016-09-27 04:00:00"
"59106","Twitter’s Steep Premium: The Cost of Employee Stock Grants",NA,"Business Day","2016-09-27 04:00:00"
"59115","Williams Companies, Under Pressure, Continues Board Overhaul",NA,"Business Day","2016-09-27 04:00:00"
"59121","Pfizer Remains Whole, but the Option to Split Could Return","Breakingviews","Business Day","2016-09-27 04:00:00"
"59125","S.E.C. Takes Different Strategy in Insider Trading Case","White Collar Watch","Business Day","2016-09-27 04:00:00"
"59134","Fly-Along Companions Offer a Way for Older People to Travel","Itineraries","Business Day","2016-09-27 04:00:00"
"59138","A New Debate Over Pricing the Risks of Climate Change",NA,"Business Day","2016-09-27 04:00:00"
"59139","Audi’s Research and Development Chief Leaves as VW Inquiries Continue",NA,"Business Day","2016-09-27 04:00:00"
"59142","Wall St. Closes Lower, Weighed Down by Banks and Health Care",NA,"Business Day","2016-09-27 04:00:00"
"59145","Two Exchange Operators, CBOE and Bats, Agree to Merge",NA,"Business Day","2016-09-27 04:00:00"
"59148","Deutsche Bank Denies Asking Germany to Help in U.S. Dispute",NA,"Business Day","2016-09-27 04:00:00"
"59149","FreshDirect Secures New Backing Despite Growing Competition in Online Groceries",NA,"Business Day","2016-09-27 04:00:00"
"59160","Morning Agenda: ‘Brexit’ Fears, One Click Payment, and Clinton-Goldman Ties",NA,"Business Day","2016-09-27 04:00:00"
"59206","Wells Fargo C.E.O.’s Prepared House Testimony",NA,"Business Day","2016-09-28 04:00:00"
"59253","Wells Fargo to Claw Back $41 Million of Chief’s Pay Over Scandal",NA,"Business Day","2016-09-28 04:00:00"
"59271","World Bank Picks Jim Yong Kim for Second Term as President",NA,"Business Day","2016-09-28 04:00:00"
"59272","Charles L. Schultze, 91, Dies; Advised Presidents on Economic Policy",NA,"Business Day","2016-09-28 04:00:00"
"59274","A.I.G. Ex-Chief Testifies at Trial, 11 Years After Charges",NA,"Business Day","2016-09-28 04:00:00"
"59279","Furor Over Drug Prices Puts Patient Advocacy Groups in Bind",NA,"Business Day","2016-09-28 04:00:00"
"59280","Greek Lawmakers Pass Additional Austerity Measures",NA,"Business Day","2016-09-28 04:00:00"
"59286","Standard Chartered’s U.S. Settlement Is Imperiled by New Claims",NA,"Business Day","2016-09-28 04:00:00"
"59289","By Taking Back Money, Wells Fargo’s Board Seems to Recall Its Role","Fair Game","Business Day","2016-09-28 04:00:00"
"59292","Chinese Tourists Pump Cash Into a Hot Destination: China",NA,"Business Day","2016-09-28 04:00:00"
"59298","Caesars Entertainment to Emerge From Chapter 11 Bankruptcy",NA,"Business Day","2016-09-28 04:00:00"
"59308","At 84 Million Viewers, Debate Was the Most-Watched Ever",NA,"Business Day","2016-09-28 04:00:00"
"59329","Rice Energy Acquisition Shows Limits of Natural Gas Deals","Breakingviews","Business Day","2016-09-28 04:00:00"
"59350","Surge in Consumer Confidence Drives Rally After Days of Losses",NA,"Business Day","2016-09-28 04:00:00"
"59354","Merger of Anheuser-Busch InBev and SABMiller Faces Final Hurdle",NA,"Business Day","2016-09-28 04:00:00"
"59362","What Can Mexico Do About Trump?","Economic Scene","Business Day","2016-09-28 04:00:00"
"59365","Morning Agenda: Debating Trump, the Twitter Premium, Closing a Flagship Fund",NA,"Business Day","2016-09-28 04:00:00"
"59499","House Panel Questions Fed Chief on Wells Fargo Scandal",NA,"Business Day","2016-09-29 04:00:00"
"59502","Former A.I.G Chief Spars With Prosecutor at His Fraud Trial",NA,"Business Day","2016-09-29 04:00:00"
"59503","OPEC Agrees to Cut Production, Sending Oil Prices Soaring",NA,"Business Day","2016-09-29 04:00:00"
"59505","Deutsche Bank Is the Darling of the Short-Sellers",NA,"Business Day","2016-09-29 04:00:00"
"59507","I.M.F. Chief Lagarde Calls Trade Restrictions ‘Economic Malpractice’",NA,"Business Day","2016-09-29 04:00:00"
"59509","Coachella Classic: A Festival for Rock Giants and Their Aging Fans",NA,"Business Day","2016-09-29 04:00:00"
"59512","U.S. Just Made It a Lot Less Difficult to Sue Nursing Homes",NA,"Business Day","2016-09-29 04:00:00"
"59514","Alec Baldwin Joins ‘S.N.L.’ as Donald Trump",NA,"Business Day","2016-09-29 04:00:00"
"59515","YouTube Hires Music Executive as a Liaison to the Industry",NA,"Business Day","2016-09-29 04:00:00"
"59517","For Some Newspapers, Endorsing Clinton Means Losing Subscribers",NA,"Business Day","2016-09-29 04:00:00"
"59527","CBS and Viacom, Long Split, Will Be Told to Consider Reuniting",NA,"Business Day","2016-09-29 04:00:00"
"59530","What Stumpf Is Telling Congress About the Wells Fargo Scandal",NA,"Business Day","2016-09-29 04:00:00"
"59537","California Suspends Ties With Wells Fargo",NA,"Business Day","2016-09-29 04:00:00"
"59539","Donald Verrilli, Former Solicitor General, to Join Law Firm",NA,"Business Day","2016-09-29 04:00:00"
"59541","In Caesars Bankruptcy Fight, Private Equity Owners Fold","Breakingviews","Business Day","2016-09-29 04:00:00"
"59545","Och-Ziff African Unit Expected to Plead Guilty to Bribery",NA,"Business Day","2016-09-29 04:00:00"
"59552","Maine’s ‘Clean’ Medical Marijuana: ‘Organic’ in Disguise","Entrepreneurship","Business Day","2016-09-29 04:00:00"
"59561","Regulators to Review London Stock Exchange-Deutsche Börse Merger",NA,"Business Day","2016-09-29 04:00:00"
"59569","More Wealth, More Jobs, but Not for Everyone: What Fuels the Backlash on Trade",NA,"Business Day","2016-09-29 04:00:00"
"59577","Wall St., Powered by Oil, Ends Higher",NA,"Business Day","2016-09-29 04:00:00"
"59592","Shareholders Approve SABMiller Takeover by Anheuser-Busch InBev",NA,"Business Day","2016-09-29 04:00:00"
"59596","Morning Agenda: Wells Fargo Clawback, Standard Chartered Investigated, Ex-A.I.G. Chief Testifies",NA,"Business Day","2016-09-29 04:00:00"
"59598","Deutsche Bank, Facing Challenges, Says It Will Sell Abbey Life",NA,"Business Day","2016-09-29 04:00:00"
"59603","Perella Weinberg Partners Split Off to Open Investment Firm",NA,"Business Day","2016-09-29 04:00:00"
"59645","Dining In: Homemade Chili Gains Ground on Chili’s",NA,"Business Day","2016-09-30 18:20:35"
"59657","Nutanix, a Cloud-Based Business, Soars in I.P.O.",NA,"Business Day","2016-09-30 16:45:24"
"59672","Laurene Powell Jobs Invests in Production and Talent Management Firm",NA,"Business Day","2016-09-30 15:00:39"
"59679","Wall St. Ends Higher on Consumer Stock Gains",NA,"Business Day","2016-09-30 14:06:26"
"59682","Brands to Ad Agencies: Diversify or Else",NA,"Business Day","2016-09-30 13:02:12"
"59691","China Manipulates Its Currency, but Not in the Way Trump Claims",NA,"Business Day","2016-09-30 11:37:34"
"59692","How to Help a Failing Boss See the Light, if You Must","The Workologist","Business Day","2016-09-30 11:00:05"
"59693","Deutsche Bank Troubles Raise Fear of Global Shock",NA,"Business Day","2016-09-30 10:49:56"
"59735","Harvard Hires New Endowment Manager From Columbia",NA,"Business Day","2016-09-30 04:00:00"
"59752","I.P.O. Values Cloud Company Nutanix at $2.18 Billion",NA,"Business Day","2016-09-30 04:00:00"
"59760","Concern Over Deutsche Bank’s Health Shakes Markets",NA,"Business Day","2016-09-30 04:00:00"
"59762","U.S. Paid Insurers Funds Meant for Treasury, Auditors Say",NA,"Business Day","2016-09-30 04:00:00"
"59764","Offshore Wind Farms See Promise in Platforms That Float",NA,"Business Day","2016-09-30 04:00:00"
"59774","Ex-A.I.G. Chief Parries Inquiries on Offshore Reinsurer in Fraud Trial",NA,"Business Day","2016-09-30 04:00:00"
"59783","Qualcomm Is Said to Be in Talks to Buy NXP Semiconductors",NA,"Business Day","2016-09-30 04:00:00"
"59810","Och-Ziff to Pay Over $400 Million in Bribery Settlement",NA,"Business Day","2016-09-30 04:00:00"
"59813","Wells Fargo’s Reaction to Scandal Fails to Satisfy Angry Lawmakers",NA,"Business Day","2016-09-30 04:00:00"
"59818","Mary Weber Novak, Top California Vintner, Dies at 84",NA,"Business Day","2016-09-30 04:00:00"
"59819","What Wells Fargo’s C.E.O. Told Congress",NA,"Business Day","2016-09-30 04:00:00"
"59824","Keep the Tax Returns, Trump; Just Give Us a Few Figures","Common Sense","Business Day","2016-09-30 04:00:00"
"59838","How a Merger of Viacom and CBS Might Make Sense","Breakingviews","Business Day","2016-09-30 04:00:00"
"59842","IBM to Acquire Promontory, a Financial Consulting Firm",NA,"Business Day","2016-09-30 04:00:00"
"59852","Wall St. Closes Lower as Drug-Price Scrutiny Intensifies",NA,"Business Day","2016-09-30 04:00:00"
"59853","In Letter, Redstones Urge Viacom and CBS to Explore Merger",NA,"Business Day","2016-09-30 04:00:00"
"59861","U.S. Will Require Its Contractors to Provide Paid Sick Leave",NA,"Business Day","2016-09-30 04:00:00"
"59862","Former BlackRock Fund Manager Charged With Insider Trading",NA,"Business Day","2016-09-30 04:00:00"
"59868","Morning Agenda: CBS and Viacom, Rules on Arbitration, Deutsche Bank Gloom",NA,"Business Day","2016-09-30 04:00:00"
"59875","Ronald P. Stanton, Trammo Founder Who Shared His Fortune, Dies at 88",NA,"Business Day","2016-09-30 04:00:00"
"59938","Redstones Await Response From CBS on Merger Request",NA,"Business Day","2016-10-01 04:00:00"
"59948","Glaxo to Pay $20 Million to Settle U.S. Bribery Case in China",NA,"Business Day","2016-10-01 04:00:00"
"59952","Appeals Court Rulings Thrust Antitrust Policy Into the Spotlight","Another View","Business Day","2016-10-01 04:00:00"
"59976","Deutsche Bank Has Problems, but Not With Liquidity","Breakingviews","Business Day","2016-10-01 04:00:00"
"59994","Morning Agenda: Deutsche Gloom, Och Ziff Bribery, More Tech Reformation",NA,"Business Day","2016-10-01 04:00:00"
"59995","R.B.S. to Rename Investment Bank as It Walls Off Retail Units",NA,"Business Day","2016-10-01 04:00:00"
"60016","How Donald Trump Turned the Tax Code Into a Giant Tax Shelter","Common Sense","Business Day","2016-10-02 22:16:14"
"60122","Serving Up Health Care",NA,"Business Day","2016-10-02 04:00:00"
"60141","A Curious Plan to Fight Climate Change: Buy Mines, Sell Coal",NA,"Business Day","2016-10-02 04:00:00"
"60162","Executive Pay Clawbacks Are Gratifying, but Not Particularly Effective","Fair Game","Business Day","2016-10-02 04:00:00"
"60188","Cindy Whitehead: No Nickname? Just Leave That to Me","Corner Office","Business Day","2016-10-02 04:00:00"
"60242","Data on Road Deaths by Country",NA,"Business Day","2016-10-03 04:00:00"
"60276","Global Mergers Decline in Third Quarter",NA,"Business Day","2016-10-03 04:00:00"
"60322","Tesla Moves Closer to Target With 70 Percent Delivery Increase",NA,"Business Day","2016-10-03 04:00:00"
"60339","Disney’s Hot Streak Stalls, Prompting Rumors That It’s Looking to Grow",NA,"Business Day","2016-10-03 04:00:00"
"60340","Tricky Goal for ‘Birth of a Nation’: Inspire but Don’t Incite",NA,"Business Day","2016-10-03 04:00:00"
"60342","On Twitter, Hate Speech Bounded Only by a Character Limit","Mediator","Business Day","2016-10-03 04:00:00"
"60343","The Online Video View: We Can Count It, but Can We Count on It?","Advertising","Business Day","2016-10-03 04:00:00"
"60344","Deutsche Bank’s Appetite for Risk Throws Off Its Balance",NA,"Business Day","2016-10-03 04:00:00"
"60351","Google to Unveil New Devices, and Labor Dept. Will Report on Jobs","The Week Ahead","Business Day","2016-10-03 04:00:00"
"60361","Treasury Auctions Set for the Week of Oct. 3",NA,"Business Day","2016-10-03 04:00:00"
"60364","Texas Businessman Agrees to Pay $198.1 Million in Fraud Case",NA,"Business Day","2016-10-03 04:00:00"
"60374","With Vinyl, the Musician Tycho Establishes a Physical Presence",NA,"Business Day","2016-10-03 04:00:00"
"60441","When It Comes to Tax Avoidance, Donald Trump’s Just a Small Fry","DealBook","Business Day","2016-10-04 04:00:00"
"60453","Tips for Avoiding Traffic Accidents Abroad","Itineraries","Business Day","2016-10-04 04:00:00"
"60456","Study-Abroad Programs Address a Risk: Road Fatalities","Itineraries","Business Day","2016-10-04 04:00:00"
"60461","Four From BuzzFeed Politics Defect to CNN",NA,"Business Day","2016-10-04 04:00:00"
"60464","Judges Push Brevity in Briefs, and Get a Torrent of Arguments",NA,"Business Day","2016-10-04 04:00:00"
"60465","Scrutiny of Commercial Real Estate Loans Chills Small Lenders",NA,"Business Day","2016-10-04 04:00:00"
"60466","Women Shun the Maternity Smock, and Stores Race to Catch Up",NA,"Business Day","2016-10-04 04:00:00"
"60479","Cantor Fitzgerald Gambling Affiliate Settles Investigation",NA,"Business Day","2016-10-04 04:00:00"
"60486","The Trump Campaign’s Questionable Tax Return Justification","Fair Game","Business Day","2016-10-04 04:00:00"
"60497","Och-Ziff May Face Consequences Beyond Fine in Bribery Case","White Collar Watch","Business Day","2016-10-04 04:00:00"
"60498","Nutanix I.P.O. Creates Opening for Others","Breakingviews","Business Day","2016-10-04 04:00:00"
"60511","Bass Pro Shops to Acquire Cabela’s, a Rival Outdoor Retailer",NA,"Business Day","2016-10-04 04:00:00"
"60512","Real Estate and Utilities Drag Wall Street Down",NA,"Business Day","2016-10-04 04:00:00"
"60526","Morning Agenda: Disney’s Next Deal, Trump’s Tax Shelter, Deutsche Off Balance",NA,"Business Day","2016-10-04 04:00:00"
"60537","Janus to Merge With Henderson, Forming Asset Management Giant",NA,"Business Day","2016-10-04 04:00:00"
"60568","The Editorialists Have Spoken; Will Voters Listen?","Mediator","Business Day","2016-10-05 19:30:05"
"60579","The Neighborhood Bookstore’s Unlikely Ally? The Internet",NA,"Business Day","2016-10-05 16:59:49"
"60583","What Is a ‘Personal Benefit’ From Insider Trading? Justices Hear Arguments",NA,"Business Day","2016-10-05 16:31:33"
"60589","‘Patriots Day’ Eases Into Promotion With Solemn Tone",NA,"Business Day","2016-10-05 16:07:52"
"60593","Deutsche Bank Singled Out in I.M.F. Stability Warning",NA,"Business Day","2016-10-05 15:24:42"
"60601","Wall St. Closes Higher, Led by Energy and Bank Stocks",NA,"Business Day","2016-10-05 14:07:13"
"60603","Samsung in Cross Hairs of American Hedge Fund",NA,"Business Day","2016-10-05 13:52:58"
"60646","Prepaid Debit Cards Users Will Get New Federal Protections",NA,"Business Day","2016-10-05 04:00:00"
"60670","Obama Hails Enforcement on Trade Deals to Win Support for T.P.P.",NA,"Business Day","2016-10-05 04:00:00"
"60673","Former A.I.G. Chief Denies He Knew of Payback Terms in Reinsurance Deal",NA,"Business Day","2016-10-05 04:00:00"
"60680","Fannie and Freddie Investors Win Round in Suit Against U.S.",NA,"Business Day","2016-10-05 04:00:00"
"60685","IBM Is Buying Consulting Firm for Its Washington Connections","Street Scene","Business Day","2016-10-05 04:00:00"
"60695","Supreme Court Case to Test Prosecution of Insider Trading","Another View","Business Day","2016-10-05 04:00:00"
"60697","Goldman Sachs Deal Maker John Vaske to Retire",NA,"Business Day","2016-10-05 04:00:00"
"60698","Hedge Fund Targets Companies’ Weakness: The Gender Gap",NA,"Business Day","2016-10-05 04:00:00"
"60707","How Shari Redstone Turned the Tide",NA,"Business Day","2016-10-05 04:00:00"
"60711","The Limits of Deutsche’s Troubles Show Reform Is Working","Breakingviews","Business Day","2016-10-05 04:00:00"
"60715","A Maryland County Tries to Tame a Stretch of Suburban Sprawl","Square Feet","Business Day","2016-10-05 04:00:00"
"60736","Utilities Drive Shares Down and Bond Yields Rise",NA,"Business Day","2016-10-05 04:00:00"
"60744","I.M.F. Warns of Anti-Trade Sentiment Amid Weak Global Growth",NA,"Business Day","2016-10-05 04:00:00"
"60748","Next ‘Renewable Energy’: Burning Forests, if Senators Get Their Way","Economic Scene","Business Day","2016-10-05 04:00:00"
"60756","Morning Agenda: Small-Fry Tax Avoidance, an Outdoor Merger, a Chill on Small Lenders",NA,"Business Day","2016-10-05 04:00:00"
"60762","LVMH to Take 80% Stake in German Luggage Brand Rimowa",NA,"Business Day","2016-10-05 04:00:00"
"60864","Theranos to Close Labs and Lay Off 340 Workers",NA,"Business Day","2016-10-06 02:24:10"
"60870","A.I.G. Ex-Chief Maintains He Knew of Nothing Improper in ‘Sham’ Deal",NA,"Business Day","2016-10-06 04:00:00"
"60877","Oil Glut? Here Comes Some More!",NA,"Business Day","2016-10-06 00:46:50"
"60890","Vice-Presidential Debate Generates Fireworks, but Not Ratings",NA,"Business Day","2016-10-06 04:00:00"
"60891","Richard J. Schwartz, Who Expanded Jonathan Logan’s Dress Empire, Dies at 77",NA,"Business Day","2016-10-06 04:00:00"
"60900","Southwest Flight Evacuated After Samsung Phone Catches Fire, Airline Says",NA,"Business Day","2016-10-06 04:00:00"
"60906","Elliott’s Demands on Samsung Might Have Staying Power","Breakingviews","Business Day","2016-10-06 04:00:00"
"60913","How Much Is It Worth to Hold Your Newborn? $40, Apparently",NA,"Business Day","2016-10-06 04:00:00"
"60941","Morning Agenda: Fights Over Fannie and Freddie, Gender Gaps, Trade Warnings",NA,"Business Day","2016-10-06 04:00:00"
"60944","Sompo of Japan Buying Endurance, a Specialty Insurer",NA,"Business Day","2016-10-06 04:00:00"
"61030","The Pound’s ‘Flash Crash’",NA,"Business Day","2016-10-07 12:26:25"
"61042","CIT Group Plans to Sell Its Aircraft Leasing Unit for $10 Billion",NA,"Business Day","2016-10-07 04:00:00"
"61077","A.I.G. Ex-Chief Ends Testimony in Fraud Case Unbowed",NA,"Business Day","2016-10-07 04:00:00"
"61089","5 Years Later, Jon Corzine May Avoid Trial With $5 Million Settlement",NA,"Business Day","2016-10-07 04:00:00"
"61091","After Congressional Grilling, Wells Fargo Is Berated in Newspaper Ads",NA,"Business Day","2016-10-07 04:00:00"
"61127","The Supreme Court Plays Goldilocks on Insider Trading","White Collar Watch","Business Day","2016-10-07 04:00:00"
"61140","Wells Fargo Scandal Blunts a Weapon in Banks’ Regulatory Fight","Breakingviews","Business Day","2016-10-07 04:00:00"
"61142","Mars Cashes Out Warren Buffett to Take Control of Wrigley",NA,"Business Day","2016-10-07 04:00:00"
"61155","Deutsche Bank as Next Lehman Brothers: Far-Fetched but Not Unthinkable","Common Sense","Business Day","2016-10-07 04:00:00"
"61157","Megyn Kelly and Sean Hannity Indulge in Testy Public Clash",NA,"Business Day","2016-10-07 04:00:00"
"61161","Deutsche Bank to Cut an Additional 1,000 Jobs in Germany",NA,"Business Day","2016-10-07 04:00:00"
"61162","Wall St. Ends Mixed as Oil Prices Rise",NA,"Business Day","2016-10-07 04:00:00"
"61170","Protest Against Fox Correspondent Accused of Racism for Chinatown Interviews",NA,"Business Day","2016-10-07 04:00:00"
"61176","Morning Agenda: Theranos Closes Labs, Twitter Chatter, Taking on Samsung",NA,"Business Day","2016-10-07 04:00:00"
"61259","Jane Pauley Is Back — Again",NA,"Business Day","2016-10-08 04:00:00"
"61265","Libya Starts Expanding Oil Exports — for Now, at Least",NA,"Business Day","2016-10-08 04:00:00"
"61273","Mylan to Settle EpiPen Overpricing Case for $465 Million",NA,"Business Day","2016-10-08 04:00:00"
"61277","Paying $15 Billion for Twitter Will Be Hard for Anyone to Justify","Breakingviews","Business Day","2016-10-08 04:00:00"
"61291","Thomson Reuters to Add Up to 1,500 Jobs in Toronto",NA,"Business Day","2016-10-08 04:00:00"
"61295","Britain to Resume Sale of Lloyds Banking Group Stake",NA,"Business Day","2016-10-08 04:00:00"
"61313","Wall Street Slips After Jobs Report",NA,"Business Day","2016-10-08 04:00:00"
"61324","Morning Agenda: Corzine Nears Settlement, Ads Berate Wells Fargo, Pound Plunges",NA,"Business Day","2016-10-08 04:00:00"
"61334","U.S. Economy, Showing Resilience, Added 156,000 Jobs Last Month",NA,"Business Day","2016-10-08 04:00:00"
"61336","I.P.O. Values Innogy Unit of German Utility RWE Around $22 Billion",NA,"Business Day","2016-10-08 04:00:00"
"61338","Pound Drops Sharply in Asian Trading Amid ‘Brexit’ Fears",NA,"Business Day","2016-10-08 04:00:00"
"61358","How NBC Finished Second on the Trump Video Story",NA,"Business Day","2016-10-09 15:19:27"
"61423","Political Futures","Comments","Business Day","2016-10-09 04:00:00"
"61450","Selling Shampoo, Eye Cream and a Chemical Crackdown","Revalued","Business Day","2016-10-09 04:00:00"
"61463","An Investor’s Plan to Transplant Private Health Care in Africa",NA,"Business Day","2016-10-09 04:00:00"
"61472","Wells Fargo Isn’t the Only Firm That Needs a Lesson","Fair Game","Business Day","2016-10-09 04:00:00"
"61516","Kathy Giusti: Sharing Life Lessons From a Death Sentence","Corner Office","Business Day","2016-10-09 04:00:00"
"61663","Trump Opponents and Media Seek ‘Apprentice’ Tapes via Twitter",NA,"Business Day","2016-10-10 04:00:00"
"61675","Hollywood’s Queen of Reinvention Takes on ‘Rocky Horror’",NA,"Business Day","2016-10-10 04:00:00"
"61677","Billy Bush, Host on ‘Today,’ Is Suspended by NBC",NA,"Business Day","2016-10-10 04:00:00"
"61679","Apple and Samsung Clash in the Supreme Court, and Sony Goes Virtual","The Week Ahead","Business Day","2016-10-10 04:00:00"
"61687","Trying to Disrupt the Auto Industry With The Onion’s Help","Advertising","Business Day","2016-10-10 04:00:00"
"61689","AT&T Will Stop Exchanging Fire-Prone Samsung Galaxy Note 7s",NA,"Business Day","2016-10-10 04:00:00"
"61700","Treasury Auctions Set for the Week of Oct. 10",NA,"Business Day","2016-10-10 04:00:00"
"61701","$1.6 Million Bill Tests Tiny Town and ‘Bulletproof’ Public Pensions",NA,"Business Day","2016-10-10 04:00:00"
"61712","Bulgari’s Chief: Make Your Targets Clear","Global Manager","Business Day","2016-10-10 04:00:00"
"61715","Donald Trump the Showman, Now Caught in the Klieg Lights","Mediator","Business Day","2016-10-10 04:00:00"
"61719","Europe May Finally End Its Painful Embrace of Austerity",NA,"Business Day","2016-10-10 04:00:00"
"61723","Samsung’s Response to Galaxy Note 7 Crisis Draws Criticism",NA,"Business Day","2016-10-11 23:42:03"
"61725","Billy Bush Negotiating Exit From NBC After Lewd Tape",NA,"Business Day","2016-10-11 22:20:53"
"61741","Galaxy Note 7 Abandoned by Customers",NA,"Business Day","2016-10-11 15:35:48"
"61796","Theranos Sued by Investor Who Accuses It of Securities Fraud",NA,"Business Day","2016-10-11 04:00:00"
"61811","Mark Burnett Says He Can’t Release ‘Apprentice’ Video of Donald Trump",NA,"Business Day","2016-10-11 04:00:00"
"61813","Were He Seeking Any Other Job, Trump Would Be Flagged by H.R.","DealBook","Business Day","2016-10-11 04:00:00"
"61816","Wells Fargo Reshuffles Top Ranks, Rallying Around Its No. 2",NA,"Business Day","2016-10-11 04:00:00"
"61822","Seinfeld’s ‘Comedians in Cars Getting Coffee’ Is on Market",NA,"Business Day","2016-10-11 04:00:00"
"61825","Buffett Calls Trump’s Bluff and Releases His Tax Data",NA,"Business Day","2016-10-11 04:00:00"
"61828","Special Tax on Women: Trump Tape Is a Reminder of the Cost of Harassment","The Interpreter","Business Day","2016-10-11 04:00:00"
"61834","Snooping in the Bathroom to Assess Credit Risk in China",NA,"Business Day","2016-10-11 04:00:00"
"61835","Soothing Ruffled Guests: Hotels Meet Threat of Bad Reviews","Itineraries","Business Day","2016-10-11 04:00:00"
"61842","Tyson Foods, a Meat Leader, Invests in Protein Alternatives",NA,"Business Day","2016-10-11 04:00:00"
"61846","Deutsche Bank and Walmart Face Same Gambit With Justice Dept.","White Collar Watch","Business Day","2016-10-11 04:00:00"
"61861","A Private Solution to Deutsche Bank’s Public Woes","Breakingviews","Business Day","2016-10-11 04:00:00"
"61875","Wall St. Closes Higher as Oil Prices Climb",NA,"Business Day","2016-10-11 04:00:00"
"61881","Oliver Hart and Bengt Holmstrom Win Nobel in Economics for Work on Contracts",NA,"Business Day","2016-10-11 04:00:00"
"61882","Morning Agenda: Peso Predictor, Salesforce Investors Speak, Calpers Standoff",NA,"Business Day","2016-10-11 04:00:00"
"61890","Samsung Halts Galaxy Note 7 Production as Battery Problems Linger",NA,"Business Day","2016-10-11 04:00:00"
"61911","How Wall Street Has Responded to Wells Fargo’s Scandal",NA,"Business Day","2016-10-12 22:09:12"
