"","main","kicker","section_name","pub_date"
"19883","Aaron Bell of AdRoll: The Truth May Hurt, but It Also Heals","Corner Office","Business Day","2016-03-20 00:00:00"
"20039","The Mutual Dependence of Donald Trump and the News Media","Mediator","Business Day","2016-03-21 01:14:15"
"20064","Roger Agnelli, ‘Iron Man’ Who Led a Global Mining Giant, Dies at 56",NA,"Business Day","2016-03-21 00:00:00"
"20077","Affymetrix Rejects $1.5 Billion Takeover Bid",NA,"Business Day","2016-03-21 00:00:00"
"20082","Self-Correcting Beyond a Web Era Marked by Sensationalism","News Analysis","Business Day","2016-03-21 00:00:00"
"20087","Apple iPhone Hearing, VW Diesel Update and Luxury Cars","The Week Ahead","Business Day","2016-03-21 00:00:00"
"20089","As Coal’s Future Grows Murkier, Banks Pull Financing",NA,"Business Day","2016-03-21 00:00:00"
"20096","Hollywood Divided Over Movie Streaming Service",NA,"Business Day","2016-03-21 00:00:00"
"20098","Kraft Reveals Revamped Mac and Cheese, 50 Million Boxes Later","Advertising","Business Day","2016-03-21 00:00:00"
"20100","Treasury Auctions Set for the Week of March 21",NA,"Business Day","2016-03-21 00:00:00"
"20127","Seeking Access to Facebook in China, Zuckerberg Courts Risks",NA,"Business Day","2016-03-21 00:00:00"
"20128","Sherwin-Williams to Buy Valspar for $9.3 Billion",NA,"Business Day","2016-03-21 00:00:00"
"20146","Books on Wheels",NA,"Business Day","2016-03-22 00:00:00"
"20169","Living With One Parent",NA,"Business Day","2016-03-22 00:00:00"
"20260","Bill Ackman Bets Again on Valeant, Taking a Seat on the Board","DealBook Column","Business Day","2016-03-22 00:00:00"
"20266","No Respite for Yahoo, Battling on 2 Fronts",NA,"Business Day","2016-03-22 00:00:00"
"20272","Duke Energy Will Put More Livestock Waste to Use",NA,"Business Day","2016-03-22 00:00:00"
"20273","Airbus Tests First U.S. Plane and Deems It a Success",NA,"Business Day","2016-03-22 00:00:00"
"20274","Anthem Sues Express Scripts Over Cost of Prescriptions",NA,"Business Day","2016-03-22 00:00:00"
"20282","Jury Tacks On $25 Million to Gawker’s Bill in Hulk Hogan Case",NA,"Business Day","2016-03-22 00:00:00"
"20283","Why Sanders Trails Clinton Among Minority Voters",NA,"Business Day","2016-03-22 00:00:00"
"20290","Leon Cooperman and Omega Advisors Receive S.E.C. Notice",NA,"Business Day","2016-03-22 00:00:00"
"20295","Credit Default Swaps Make Restructuring More Difficult","In Debt","Business Day","2016-03-22 00:00:00"
"20297","Analysts Urge Citigroup Split",NA,"Business Day","2016-03-22 00:00:00"
"20298","BP and Statoil Pull Employees From Algeria Gas Fields After Attack",NA,"Business Day","2016-03-22 00:00:00"
"20299","Judge Approves Orange County Register Sale to Digital First",NA,"Business Day","2016-03-22 00:00:00"
"20300","Rihanna Is Back at Top Spot on Billboard",NA,"Business Day","2016-03-22 00:00:00"
"20310","Valeant’s Struggles Could Lead It to Crumble","Breakingviews","Business Day","2016-03-22 00:00:00"
"20315","Existing-Home Sales Drop More Than Expected",NA,"Business Day","2016-03-22 00:00:00"
"20321","At Microhotels, the Price Is Right and the Space Is Tight","Itineraries","Business Day","2016-03-22 00:00:00"
"20322","Apple May Be Willing to Risk Contempt Charge","White Collar Watch","Business Day","2016-03-22 00:00:00"
"20327","­Small Gain for Market as Rebound Takes Hold and Pessimism Fades",NA,"Business Day","2016-03-22 00:00:00"
"20331","A Shake-Up at Valeant Signals the End of an Era",NA,"Business Day","2016-03-22 00:00:00"
"20333","Marriott Raises Bid for Starwood",NA,"Business Day","2016-03-22 00:00:00"
"20334","IHS and Markit, Providers of Data and Analytics, Agree to Merge",NA,"Business Day","2016-03-22 00:00:00"
"20335","James Patterson Has a Big Plan for Small Books",NA,"Business Day","2016-03-22 00:00:00"
"20340","Twitter at 10: ‘A Window Into Other Lives’",NA,"Business Day","2016-03-22 00:00:00"
"20342","China Sought Fed's Crash Notes","Inside Asia","Business Day","2016-03-22 00:30:00"
"20365","New York International Auto Show",NA,"Business Day","2016-03-23 00:00:00"
"20469","Plan to Ease Carrier Traffic Is Behind Schedule","Business Briefing","Business Day","2016-03-23 00:00:00"
"20470","Lumber Liquidators to Pay $2.5 Million to Settle Allegations","Business Briefing","Business Day","2016-03-23 00:00:00"
"20474","Merck Wins Hepatitis C Drug Patent Claim Against Gilead",NA,"Business Day","2016-03-23 00:00:00"
"20488","Puerto Rico Fights for Chapter 9 Bankruptcy in Supreme Court",NA,"Business Day","2016-03-23 00:00:00"
"20492","Goldman Banker in Document Leak Case Avoids Prison",NA,"Business Day","2016-03-23 00:00:00"
"20499","Kevin Hart to Publish Memoir Next Year",NA,"Business Day","2016-03-23 00:00:00"
"20502","Thermo Fisher’s Rival for an Affymetrix Deal Raises Its Bid",NA,"Business Day","2016-03-23 00:00:00"
"20506","An R Rating, Perhaps, for Smoking on Screen","Media Decoder","Business Day","2016-03-23 00:00:00"
"20508","The Unsettling Acquisitiveness of Anbang, a Chinese Insurer, in the U.S.","Deal Professor","Business Day","2016-03-23 00:00:00"
"20519","Chip-Card Payment System Delays Frustrate Retailers",NA,"Business Day","2016-03-23 00:00:00"
"20521","Politicians Push Marriage, but That’s Not What Would Help Children","Economic Scene","Business Day","2016-03-23 00:00:00"
"20523","Supreme Court Upholds Worker Class-Action Suit Against Tyson",NA,"Business Day","2016-03-23 00:00:00"
"20529","CIT Cuts Thain’s Bonus, Citing Slow Absorption of Acquisition","Breakingviews","Business Day","2016-03-23 00:00:00"
"20532","Sturm, Ruger, a Gun Maker, Under Pressure From New York Public Advocate",NA,"Business Day","2016-03-23 00:00:00"
"20544","Low Gas Prices Create a Detour on the Road to Greater Fuel Economy",NA,"Business Day","2016-03-23 00:00:00"
"20549","Shares Decline After Terror Attacks in Belgium",NA,"Business Day","2016-03-23 00:00:00"
"20560","R.B.S. Reimburses $1.7 Billion to British Government",NA,"Business Day","2016-03-23 00:00:00"
"20595","Selling More Cars in China",NA,"Business Day","2016-03-24 00:00:00"
"20687","New Rules Aim to Reduce Silica Exposure at Work Sites",NA,"Business Day","2016-03-24 00:00:00"
"20714","S.E.C. Orders Exxon Mobil Shareholder Vote on Climate Data",NA,"Business Day","2016-03-24 00:00:00"
"20726","Advertising Industry Wrestles With Bias After a Lawsuit",NA,"Business Day","2016-03-24 00:00:00"
"20733","At New York Auto Show, a Parade of New Models",NA,"Business Day","2016-03-24 00:00:00"
"20749","Pinnacle Foods C.E.O. Named as Next Chief of Keurig",NA,"Business Day","2016-03-24 00:00:00"
"20750","Joining Other Airlines, American Will Share Profits",NA,"Business Day","2016-03-24 00:00:00"
"20751","Valeant Losses Push Ackman Hedge Fund Down 25% for Year",NA,"Business Day","2016-03-24 00:00:00"
"20778","Fitness Entrepreneur Pleads Guilty in Wire Fraud Case",NA,"Business Day","2016-03-24 00:00:00"
"20787","New Single-Family Home Sales Soar in Western United States",NA,"Business Day","2016-03-24 00:00:00"
"20791","Fight to Keep Alternative Energy Local Stymies an Industry",NA,"Business Day","2016-03-24 00:00:00"
"20796","Valeant Has Few Options to Remove a Recalcitrant Director","Deal Professor","Business Day","2016-03-24 00:00:00"
"20800","Credit Suisse’s Too-Long Road to Recovery","Breakingviews","Business Day","2016-03-24 00:00:00"
"20812","Ex-Trader Tom Hayes Ordered to Pay $1.2 Million in Libor Case",NA,"Business Day","2016-03-24 00:00:00"
"20813","Hermès, French Luxury Goods Giant, Warns of ‘Complicated’ 2016",NA,"Business Day","2016-03-24 00:00:00"
"20816","Rule to Require Employers to Disclose Use of Anti-Union Consultants",NA,"Business Day","2016-03-24 00:00:00"
"20818","Declines in Energy and Mining Shares Drive the Market Lower",NA,"Business Day","2016-03-24 00:00:00"
"20822","Judge Orders Extradition to U.S. in ‘Flash Crash’ Case",NA,"Business Day","2016-03-24 00:00:00"
"20823","Regrouping After the Death of a Top Executive","Entrepreneurship","Business Day","2016-03-24 00:00:00"
"20824","HSBC Adds Former Chief Executive of Standard Life to Board",NA,"Business Day","2016-03-24 00:00:00"
"20827","Australian Energy Giant Woodside Delays Large Offshore L.N.G. Project",NA,"Business Day","2016-03-24 00:00:00"
"20837","Credit Suisse Chief Says Risky Bets Were a ‘Surprise’",NA,"Business Day","2016-03-24 00:00:00"
"20959","Gilead Ordered to Pay Merck $200 Million in Patent Dispute",NA,"Business Day","2016-03-25 00:00:00"
"20990","Gas Prices Will Be Low for Easter, but Don’t Get Used to It",NA,"Business Day","2016-03-25 00:00:00"
"20993","Coke Discloses More Spending on Health-Related Efforts","Business Briefing","Business Day","2016-03-25 00:00:00"
"20995","Autoworkers Union Grew for 6th Consecutive Year","Business Briefing","Business Day","2016-03-25 00:00:00"
"20997","Challenge to Yahoo’s Board Makes a Sale More Certain","Deal Professor","Business Day","2016-03-25 00:00:00"
"20999","Law Graduate Who Sued Her School Loses at Trial",NA,"Business Day","2016-03-25 00:00:00"
"21014","Playboy Enterprises Said to Explore Sale",NA,"Business Day","2016-03-25 00:00:00"
"21031","On Business Issues, Republicans Might Want a Justice Garland","Common Sense","Business Day","2016-03-25 00:00:00"
"21035","Apple’s First Foray Into Original TV Is a Series About Apps",NA,"Business Day","2016-03-25 00:00:00"
"21042","Plan to Rescue Puerto Rico Advances, Led by House Republicans",NA,"Business Day","2016-03-25 00:00:00"
"21049","Durable Goods Orders Dropped 2.8% in February",NA,"Business Day","2016-03-25 00:00:00"
"21050","A Yahoo Investor’s Bold Push to Replace Its Board","Breakingviews","Business Day","2016-03-25 00:00:00"
"21062","Hedge Funds Dealt Setback as U.S. Sides With Argentina on Defaulted Bonds",NA,"Business Day","2016-03-25 00:00:00"
"21072","In Shift to Streaming, Music Business Has Lost Billions",NA,"Business Day","2016-03-25 00:00:00"
"21073","Court Sets Deadline for a Volkswagen Diesel Fix, but Solution Could Prove Elusive",NA,"Business Day","2016-03-25 00:00:00"
"21075","Senate Bill Would Limit Shareholder Rights","Another View","Business Day","2016-03-25 00:00:00"
"21087","Falling Oil Prices Bring End to Rally for the Market",NA,"Business Day","2016-03-25 00:00:00"
"21091","TiVo Said to Be in Merger Talks With Rovi",NA,"Business Day","2016-03-25 00:00:00"
"21094","R.B.S. Hires Former Barclays Lawyer as General Counsel",NA,"Business Day","2016-03-25 00:00:00"
"21104","Tidjane Thiam, Chief of Credit Suisse, Was Paid $4.7 Million in 2015",NA,"Business Day","2016-03-25 00:00:00"
"21115","Entire Yahoo Board Would Be Ousted if Starboard Value Gets Its Way",NA,"Business Day","2016-03-25 00:00:00"
"21186","Japanese Inflation Is Flat in Year to February",NA,"Business Day","2016-03-26 00:00:00"
"21187","Most Global Exchanges Close for Good Friday",NA,"Business Day","2016-03-26 00:00:00"
"21189","Ten States Still Have Fewer Jobs Since Recession",NA,"Business Day","2016-03-26 00:00:00"
"21207","Wind Power Transmission Project in Plains Earns U.S. Approval",NA,"Business Day","2016-03-26 00:00:00"
"21209","G.D.P. for 4th Quarter Is Revised Upward",NA,"Business Day","2016-03-26 00:00:00"
"21216","Tribune Chief Discusses Transforming a Mature Media Company",NA,"Business Day","2016-03-26 00:00:00"
"21229","Products and Competition Stretch Market for ‘Athleisure’ Clothing",NA,"Business Day","2016-03-26 00:00:00"
"21234","Thomas the Tank Engine’s Expanding World",NA,"Business Day","2016-03-26 00:00:00"
"21402","A Hard-Driving Executive’s Year of Learning to Let Go","Preoccupations","Business Day","2016-03-27 00:00:00"
"21404","A Ski Town Greenhouse Takes Local Produce to Another Level","Prototype","Business Day","2016-03-27 00:00:00"
"21411","Fighting a Cage Match to Turn UFC Into a National Phenomenon",NA,"Business Day","2016-03-27 00:00:00"
"21467","In Yahoo, Another Example of the Buyback Mirage","Fair Game","Business Day","2016-03-27 00:00:00"
"21558","Fraud Charges for Financial Executive",NA,"Business Day","2016-03-28 00:00:00"
"21604","A Castro Met a Free Press, and the World Watched It Live","Mediator","Business Day","2016-03-28 00:47:36"
"21637","Ben Gray to Leave TPG Capital in Asia",NA,"Business Day","2016-03-28 00:00:00"
"21638","Al Jazeera Announces Layoffs, Mostly in Qatar",NA,"Business Day","2016-03-28 00:00:00"
"21639","Charter’s $67 Billion Cable Merger Hinges on the Cord Cutters",NA,"Business Day","2016-03-28 00:00:00"
"21650","Ethereum, a Virtual Currency, Enables Transactions That Rival Bitcoin’s",NA,"Business Day","2016-03-28 00:00:00"
"21660","Small Gains in the U.S. and Concerns in China","The Week Ahead","Business Day","2016-03-28 00:00:00"
"21664","Hotel Chains and Travel Websites in a Tug of War for Customers","Advertising","Business Day","2016-03-28 00:00:00"
"21666","Treasury Auctions Set for the Week of March 28",NA,"Business Day","2016-03-28 00:00:00"
"21680","Israeli Court Strikes Down Natural Gas Development Deal",NA,"Business Day","2016-03-28 00:00:00"
"21696","Building a Business Model to Help Solve Social Issues","Global Manager","Business Day","2016-03-28 12:30:00"
"21700","Ann Patchett’s Nashville Bookstore Hits the Road, With Dogs in Tow",NA,"Business Day","2016-03-28 00:00:00"
"21834","$15-an-Hour Minimum Wage in California? Plan Has Some Worried","News Analysis","Business Day","2016-03-29 00:00:00"
"21836","ValueAct Pays a Price for Its Supporting Role at Valeant","DealBook Column","Business Day","2016-03-29 00:00:00"
"21840","Federal Judge in Puerto Rico Calls Walmart Tax Unlawful",NA,"Business Day","2016-03-29 00:00:00"
"21844","Pandora Replaces Chief, Aiming to Reinvent Itself Midstream",NA,"Business Day","2016-03-29 00:00:00"
"21848","Avon Shakes Up Its Board to Appease Shareholders","Business Briefing","Business Day","2016-03-29 00:00:00"
"21849","Valeant Chief to Testify Before Senate in April",NA,"Business Day","2016-03-29 00:00:00"
"21861","CNN Hires David Gregory as Political Analyst as 2016 Campaign Heats Up",NA,"Business Day","2016-03-29 00:00:00"
"21865","Affymetrix to Stick With Thermo Fisher’s Takeover Proposal",NA,"Business Day","2016-03-29 00:00:00"
"21867","Valeant’s Accounting Error a Warning Sign of Bigger Problems",NA,"Business Day","2016-03-29 00:00:00"
"21875","Valeant Shares Plunge After C.E.O. Is Subpoenaed by Congress",NA,"Business Day","2016-03-29 00:00:00"
"21876","Study of Theranos Medical Tests Finds Irregular Results",NA,"Business Day","2016-03-29 00:00:00"
"21877","Automakers Expanding in China May Soon Face Weakening Demand",NA,"Business Day","2016-03-29 00:00:00"
"21879","Pandora’s Worrisome Sign: Return of the Founder as C.E.O.","Breakingviews","Business Day","2016-03-29 00:00:00"
"21889","Consumer Spending Rose Slightly in February",NA,"Business Day","2016-03-29 00:00:00"
"21892","Using Apps to Ease the Headache of Navigating Airports","Itineraries","Business Day","2016-03-29 00:00:00"
"21895","Wall Street Scion Is Accused of Faking Investments",NA,"Business Day","2016-03-29 00:00:00"
"21901","As Valeant Struggles, Its Tally Sheet of Scandals Grows","White Collar Watch","Business Day","2016-03-29 00:00:00"
"21904","Jill Abramson, Former New York Times Editor, to Write Guardian Column",NA,"Business Day","2016-03-29 00:00:00"
"21910","Market Wavers as Energy Falls and Media Climbs",NA,"Business Day","2016-03-29 00:00:00"
"21911","Starwood Bidding War Escalates With Higher Offer",NA,"Business Day","2016-03-29 00:00:00"
"21917","Dell to Sell Perot Systems to NTT Data of Japan for About $3.1 Billion",NA,"Business Day","2016-03-29 00:00:00"
"21963","Lipstick Columns in The New Yorker",NA,"Business Day","2016-03-30 00:00:00"
"22076","Spotify Expected to Sign $1 Billion Financing Deal",NA,"Business Day","2016-03-30 00:00:00"
"22084","SunEdison at ‘Substantial Risk’ of Bankruptcy","Business Briefing","Business Day","2016-03-30 00:00:00"
"22092","Latest Plan to Rescue Puerto Rico Is Met With Disdain on Island",NA,"Business Day","2016-03-30 00:00:00"
"22096","Simmering for Decades, Anger About Trade Boils Over in ’16 Election",NA,"Business Day","2016-03-30 00:00:00"
"22100","Explaining Valeant: The Main Theories","Deal Professor","Business Day","2016-03-30 00:00:00"
"22103","Lester C. Thurow, Economist Who Seized the Spotlight, Is Dead at 77",NA,"Business Day","2016-03-30 00:00:00"
"22115","In Comic-Con v. Comic Con, Proceedings Are Opaque",NA,"Business Day","2016-03-30 00:00:00"
"22119","Louis Bacon’s Charity Says It Was Victim of Executive Accused of Fraud",NA,"Business Day","2016-03-30 00:00:00"
"22123","Home Price Index Continued Steady Climb in January",NA,"Business Day","2016-03-30 00:00:00"
"22132","Starwood’s Takeover Offer From Anbang Is Risky, but Worth It","Breakingviews","Business Day","2016-03-30 00:00:00"
"22139","F.T.C. Sues Volkswagen Over ‘Deceptive’ Diesel Car Ads",NA,"Business Day","2016-03-30 00:00:00"
"22140","Edison International Starts Energy Consultancy",NA,"Business Day","2016-03-30 00:00:00"
"22141","Bank of England to Raise Bank Capital Buffer as Safeguard",NA,"Business Day","2016-03-30 00:00:00"
"22142","Janet Yellen Says Fed Still Plans to Raise Interest Rates but Carefully",NA,"Business Day","2016-03-30 00:00:00"
"22143","Technology to Make Clean Energy From Coal Is Stumbling in Practice",NA,"Business Day","2016-03-30 00:00:00"
"22148","Starwood Bidder Is a Reclusive Chinese Insurer With Opaque Backing",NA,"Business Day","2016-03-30 00:00:00"
"22159","Yellen’s Remarks Move Market to Year’s Highest Point",NA,"Business Day","2016-03-30 00:00:00"
"22171","Robo-Adviser Betterment Gets $100 Million in Venture Capital",NA,"Business Day","2016-03-30 00:00:00"
"22175","Nafta May Have Saved Many Autoworkers’ Jobs","Economic Scene","Business Day","2016-03-30 00:00:00"
"22176","Prosecutor in Bear Stearns Case to Leave U.S. Attorney’s Office",NA,"Business Day","2016-03-30 00:00:00"
"22338","German Inflation Is Positive After E.C.B. Policy Move",NA,"Business Day","2016-03-31 00:00:00"
"22339","If Starwood Makes a Deal With Anbang, Can It Be Done?","Deal Professor","Business Day","2016-03-31 00:00:00"
"22342","O.E.C.D. Lowers Its Forecast for Global Growth This Year",NA,"Business Day","2016-03-31 00:00:00"
"22343","Cancer Charities Will Pay Fine for Fraud, and Then Dissolve",NA,"Business Day","2016-03-31 00:00:00"
"22346","General Motors Ignition Switch Is Cleared in Trial Over a Crash",NA,"Business Day","2016-03-31 00:00:00"
"22348","‘Fintech’ Start-Up Boom Said to Threaten Bank Jobs",NA,"Business Day","2016-03-31 00:00:00"
"22355","MetLife Decision Could Torpedo Dodd-Frank Risk Protections","In Debt","Business Day","2016-03-31 00:00:00"
"22361","Associated Press Denies Cooperating With Nazis",NA,"Business Day","2016-03-31 00:00:00"
"22370","Cravath Law Firm Discloses a Data Attack",NA,"Business Day","2016-03-31 00:00:00"
"22385","Facebook’s Live Videos Get Lots of Looks but No Money Yet",NA,"Business Day","2016-03-31 00:00:00"
"22395","MetLife Wins Battle to Remove ‘Too Big to Fail’ Label",NA,"Business Day","2016-03-31 00:00:00"
"22403","Foxconn’s Deal to Buy Sharp Is a Test for Japanese Reform","Breakingviews","Business Day","2016-03-31 00:00:00"
"22404","Private Sector Adds 200,000 Jobs, ADP Says",NA,"Business Day","2016-03-31 00:00:00"
"22409","Peter Chernin Aims New Streaming Service at Social Media Users",NA,"Business Day","2016-03-31 00:00:00"
"22411","Wall St. Is Higher, Led by Banking and Tech",NA,"Business Day","2016-03-31 00:00:00"
"22415","State Street to Buy G.E.’s Asset Management Business",NA,"Business Day","2016-03-31 00:00:00"
"22421","Pop-Up Stores Thrive in a World of Failing Retailers","Entrepreneurship","Business Day","2016-03-31 00:00:00"
"22430","Swedbank to Replace Chairman After He Lost Investor Support",NA,"Business Day","2016-03-31 00:00:00"
"22431","Metro Group of Germany to Split Into 2 Companies",NA,"Business Day","2016-03-31 00:00:00"
"22432","To Woo Apple, Foxconn Bets $3.5 Billion on Sharp",NA,"Business Day","2016-03-31 00:00:00"
"22441","SoundCloud Starts Subscription Plan, Taking On Spotify and Apple",NA,"Business Day","2016-03-31 00:00:00"
"22488",NA,"Jobs and Wages Notch Gains as the Economy Tries to Heal","Business Day","2016-04-01 09:00:19"
"22522",NA,"K.K.R. Selling Stake in the Fashion Group SMCP to Shandong Ruyi of China","Business Day","2016-04-01 00:00:00"
"22561",NA,"Report Shows Theranos Testing Plagued by Problems","Business Day","2016-04-01 00:00:00"
"22583",NA,"Crude Oil Production Falls to Lowest Level Since 2014","Business Day","2016-04-01 00:00:00"
"22585",NA,"SunEdison Receives Subpoena From Justice Department","Business Day","2016-04-01 00:00:00"
"22586",NA,"McDonald’s Plans to Add New Restaurants in Asia","Business Day","2016-04-01 00:00:00"
"22592",NA,"Despite Wall St. Wavering, Merger Market Is Largely Intact","Business Day","2016-04-01 00:00:00"
"22607",NA,"#OscarsSoWhite Makes a Court Appearance","Business Day","2016-04-01 00:00:00"
"22609",NA,"Starwood Bidding War Ends Abruptly, Yielding a Merger and a Puzzle","Business Day","2016-04-01 00:00:00"
"22644",NA,"The Cities on the Sunny Side of the American Economy","Business Day","2016-04-01 00:00:00"
"22652",NA,"Corporations No Longer Sit Idly By on Discrimination","Business Day","2016-04-01 00:00:00"
"22653",NA,"Pittsburgh TV Anchor Is Fired After Racial Facebook Post","Business Day","2016-04-01 00:00:00"
"22655",NA,"Beware of April Fools’ Day ","Business Day","2016-04-01 00:00:00"
"22658",NA,"Ensuring That Educators Are Honest About Job Prospects","Business Day","2016-04-01 00:00:00"
"22661",NA,"City by City, Measuring the Recovery","Business Day","2016-04-01 00:00:00"
"22668",NA,"Argentina’s Senate Allows Payment to Bondholders","Business Day","2016-04-01 00:00:00"
"22671",NA,"Ex-Bank of America Merrill Lynch Banker to Head U.K. Financial Investments","Business Day","2016-04-01 00:00:00"
"22675",NA,"Tranquil Last Trading Day of Stormy Quarter","Business Day","2016-04-01 00:00:00"
"22683",NA,"G.E. Asks for Removal of ‘Too Big to Fail’ Label From GE Capital","Business Day","2016-04-01 00:00:00"
"22685",NA,"Whoopi Goldberg Joins Marijuana Industry With Products for Women","Business Day","2016-04-01 00:00:00"
"22704",NA,"Dalian Wanda Group Seeks to Delist Its Commercial Property Arm","Business Day","2016-04-01 00:00:00"
"22790",NA,"More Details on Banker’s Tragic Death, but Questions Persist","Business Day","2016-04-02 00:00:00"
"22791",NA,"Tesla’s New Model 3 Jump-Starts Demand for Electric Cars","Business Day","2016-04-02 00:00:00"
"22801",NA,"Andrew Sullivan, Political Blogging Pioneer, Joins New York Magazine","Business Day","2016-04-02 00:00:00"
"22804",NA,"Orange and Bouygues Telecom Call Off Takeover Talks","Business Day","2016-04-02 00:00:00"
"22806",NA,"Review: ‘Saving the Media’ Seeks Remedy for Ailing Fourth Estate","Business Day","2016-04-02 00:00:00"
"22808",NA,"In ‘Revenge Porn’ Case, Criminal Court Decision May Affect Lawsuit","Business Day","2016-04-02 00:00:00"
"22813",NA,"Tech Start-Ups Choose to Stay Private in I.P.O. Standoff","Business Day","2016-04-02 00:00:00"
"22814",NA,"Popular Quartz Countertops Pose a Risk to Workers","Business Day","2016-04-02 00:00:00"
"22815",NA,"Alternative Lenders Turn to Seasoned Insiders for Help","Business Day","2016-04-02 00:00:00"
"22817",NA,"Manufacturing Expands, Ending Five Months of Decline","Business Day","2016-04-02 00:00:00"
"22820",NA,"Chinese Phrase Adds Mystery to Anbang’s About-Face on Starwood","Business Day","2016-04-02 00:00:00"
"22824",NA,"Overall Stagnation in Legal Jobs Hides Underlying Shifts","Business Day","2016-04-02 00:00:00"
"22830",NA,"Encouraged by Jobs Report, Market Moves Higher","Business Day","2016-04-02 00:00:00"
"22838",NA,"BlackBerry Falls Short in Attempt at Android-Based Revival","Business Day","2016-04-02 00:00:00"
"22846",NA,"Home Retail to Urge Approval of $2 Billion Takeover by J Sainsbury","Business Day","2016-04-02 00:00:00"
"22853",NA,"Tesla Model 3 Orders Surge Even Before Its Unveiling","Business Day","2016-04-02 00:00:00"
"22866",NA,"A Cravath Partner Moves to Paul, Weiss","Business Day","2016-04-03 19:36:41"
"22975",NA,"Alaska Airlines Said to Be Near $2 Billion Deal for Virgin America","Business Day","2016-04-03 00:00:00"
"22989",NA,"Claims of a Ponzi Scheme in the Collapse of a Rare-Wine Seller","Business Day","2016-04-03 00:00:00"
"22992",NA,"After WikiLeaks Revelation, Greece Asks I.M.F. to Clarify Bailout Plan","Business Day","2016-04-03 00:00:00"
"22997",NA,"Bill Green, Who Dissected Washington Post Scandal, Dies at 91","Business Day","2016-04-03 00:00:00"
"23008",NA,"Eric Engberg, CBS Newsman, Dies at 74; Pioneered Political Fact-Checking","Business Day","2016-04-03 00:00:00"
"23059",NA,"A Gay, Latino Partner Tests Goldman’s Button-Down Culture","Business Day","2016-04-03 00:00:00"
"23061",NA,"A Valeant Boo-Boo May Portend Bigger Errors","Business Day","2016-04-03 00:00:00"
"23083",NA,"A $700 Juicer for the Kitchen That Caught Silicon Valley’s Eye","Business Day","2016-04-03 00:00:00"
"23090",NA,"With Romance Novels Booming, Beefcake Sells, but It Doesn’t Pay","Business Day","2016-04-03 00:00:00"
"23146",NA,"Michael C. Fina, Park Avenue Wedding Retailer, Bets on Amazon.com","Business Day","2016-04-04 14:00:54"
"23197",NA,"Drawing the Line on Gossip After the Gawker Trial","Business Day","2016-04-04 01:14:58"
"23200",NA,"A New Libor Trial, Trade Data and Fed Leaders Onstage","Business Day","2016-04-04 01:00:22"
"23212",NA,"As Messaging Apps Boom, Brands Tiptoe In","Business Day","2016-04-04 00:00:00"
"23248",NA,"Victim in Wall St. Scheme Was a Classmate of Its Accused Architect","Business Day","2016-04-04 00:00:00"
"23263",NA,"Cartoon Network’s Powerpuff Girls Fight Evil on TV and Beyond","Business Day","2016-04-04 00:00:00"
"23274",NA,"Treasury Auctions Set for the Week of April 4","Business Day","2016-04-04 00:00:00"
