"","main","kicker","section_name","pub_date"
"39370","Led Zeppelin’s Jimmy Page Testifies in ‘Stairway to Heaven’ Copyright Trial","Testimony in Led Zeppelin Copyright Trial","Business Day","2016-06-16 00:00:00"
"39376","Gawker Founder Nick Denton Confident of Company’s Future","Gawker Will Be Just Fine, Founder Says","Business Day","2016-06-16 00:00:00"
"39379","Redstone Says in a Letter He No Longer Trusts Viacom’s Chief","In Letter, Redstone Lashes Out","Business Day","2016-06-16 00:00:00"
"39380","Tencent Nears Deal to Buy Supercell, Maker of Clash of Clans","Tencent Near Deal to Control Supercell","Business Day","2016-06-16 00:00:00"
"39411","Bypassing Private Equity to Get a Slice of the Big Deal","Making Their Own Deals","Business Day","2016-06-16 00:00:00"
"39414","For Disney, Grim News in U.S. Tempers Reverie in Shanghai",NA,"Business Day","2016-06-16 00:00:00"
"39421","Fed Holds Interest Rates Steady and Plans Slower Increases","Growth Tepid, Fed Slows Plan to Raise Rates","Business Day","2016-06-16 00:00:00"
"39423","Why the I.R.S. Fails to Crack the Small-Business Tax Nut","Why the I.R.S. Fails to Crack the Small-Business ‘Tax Gap’","Business Day","2016-06-16 00:00:00"
"39425","Visium Hedge Fund Managers Charged With Insider Trading","U.S. Says Fund Used Inside Data From F.D.A.","Business Day","2016-06-16 00:00:00"
"39431","F.D.A. Warns Whole Foods on Failure to Address Food Safety Problems","F.D.A. Cites Whole Foods for Failure to Address Food Safety Problems","Business Day","2016-06-16 00:00:00"
"39432","CBS Will Show Grammy Awards Through 2026","CBS Keeps the Grammys","Business Day","2016-06-16 00:00:00"
"39439","Modest Loss for Market on Fed Inaction and Brexit Concern","Modest Losses in Market on Fed Inaction and ‘Brexit’ Concerns","Business Day","2016-06-16 00:00:00"
"39449","Inditex, Owner of Zara, Beats Profit Forecasts in First Quarter",NA,"Business Day","2016-06-16 00:00:00"
"39460","‘Brexit’ Plan for the Financial World? Cross Your Fingers","Finance Titans Batten Down for E.U. Exit","Business Day","2016-06-16 00:00:00"
"39462","U.S. Chamber Out of Step With Its Board, Report Finds","U.S. Chamber Out of Step With Board, Report Finds","Business Day","2016-06-16 00:00:00"
"39489","Angelo Mozilo Will Not Face U.S. Charges for Mortgage Fraud","Countrywide Co-Founder Will Not Face U.S. Lawsuit","Business Day","2016-06-17 21:10:53"
"39498","Viacom to Pay Chief’s Legal Bills in Fight Over Redstone Empire","Viacom Will Pay Chief’s Legal Bills in Court Battles Over Redstone Empire","Business Day","2016-06-17 19:53:29"
"39510","Prince Estate Names 2 to Manage Entertainment Assets","Prince Estate Names 2 to Manage Entertainment Assets","Business Day","2016-06-17 19:00:46"
"39535","How to Gauge a C.E.O.’s Value? Hint: It’s Not the Share Price","Gauging the Value of a C.E.O.","Business Day","2016-06-17 16:37:18"
"39558","Health and Tech Shares Lead a Down Day for the Market","Health and Tech Shares Lead a Down Day for the Market","Business Day","2016-06-17 14:00:44"
"39560","Explaining Greece’s Debt Crisis",NA,"Business Day","2016-06-17 13:37:31"
"39575","Court Documents: Viacom Director vs. Sumner Redstone",NA,"Business Day","2016-06-17 00:00:00"
"39670","After MetLife Ruling, Regulators Push Back on ‘Too Big to Fail’ Label","Regulators Push Back on ‘Too Big to Fail’ Tag","Business Day","2016-06-17 00:00:00"
"39672","Oscars’ Board May Get More Star Power, if Not Diversity",NA,"Business Day","2016-06-17 00:00:00"
"39688","A Who’s Who of Financiers Is Expected at Trump’s New York Fund-Raiser","Financiers to Attend Fund-Raiser for Trump","Business Day","2016-06-17 00:00:00"
"39690","Revlon Is Buying Elizabeth Arden for $419.3 Million","Revlon Says It Will Buy Elizabeth Arden for $419.3 Million","Business Day","2016-06-17 00:00:00"
"39723","Redstone Moves to Replace Five Viacom Directors, Escalating Battle","Redstone Moves to Replace 5 Viacom Directors, Escalating Battle","Business Day","2016-06-17 00:00:00"
"39727","21st Century Fox Names Stacey Snider Its Next Studio Chief","21st Century Fox Names Stacey Snider Its Next Studio Chief","Business Day","2016-06-17 00:00:00"
"39739","Supreme Court Rules on Legal Fees in Copyright Cases","Justices Allow the Victor in a Copyright Case to Seek Legal Fees","Business Day","2016-06-17 00:00:00"
"39742","Health Care Merger Offers Little Reward but Much Risk",NA,"Business Day","2016-06-17 00:00:00"
"39743","Microsoft-LinkedIn Deal Ignites Twitter Speculation","As Its Rivals Pair Up,  Will Twitter Be Next?","Business Day","2016-06-17 00:00:00"
"39747","After Insider Trading Conviction, a New Life as a Speaker",NA,"Business Day","2016-06-17 00:00:00"
"39750","Online Tools to Shop for Doctors Snag on Health Care’s Complexity","Unused Tools for Health Savings","Business Day","2016-06-17 00:00:00"
"39764","Afternoon Rally Helps Market End Losing Streak","Market Ends a Losing Streak","Business Day","2016-06-17 00:00:00"
"39776","Macy’s and Union Have a Deal, Averting a Strike","Macy’s and Union Have a Tentative Deal, Averting a Strike","Business Day","2016-06-17 00:00:00"
"39787","Volkswagen Looks to Deal With Cost Problems, but Faces Constraints","Volkswagen Looks to Deal With Cost Problems, but Faces Constraints","Business Day","2016-06-17 00:00:00"
"39794","Shanghai Disneyland Opens Amid Rain and Pageantry","In Bow to ‘Cross-Cultural Cooperation,’ Disney Shanghai Opens Gates","Business Day","2016-06-17 00:00:00"
"39798","Uber Rival’s $28 Billion Valuation Shows Size of China’s Ride-Sharing Market","China’s Didi, Uber Rival, Adds Cash for Battle","Business Day","2016-06-17 00:00:00"
"39806","Greece to Receive Another Chunk of Bailout Aid",NA,"Business Day","2016-06-17 05:23:47"
"39894","Visium to Sell and Liquidate Funds After Insider Trading Charges","Facing Insider Charges, Hedge Fund to Shut Down","Business Day","2016-06-18 00:57:00"
"39900","IEX Group, Critical of Wall St., Gains Approval for Stock Exchange","IEX Group  Exchange  Approved  by S.E.C.","Business Day","2016-06-18 00:01:44"
"39930","A Twist in the Zappa vs. Zappa Spat","In Zappa vs. Zappa Spat, Another Name Change","Business Day","2016-06-18 00:00:00"
"39937","Golden Parachute Would Ease Dauman’s Exit From Viacom",NA,"Business Day","2016-06-18 00:00:00"
"39942","Costly Compromises Stir Fury With the European Union","E.U.’s Ballooning Bills  Are Stirring Fury","Business Day","2016-06-18 00:00:00"
"39946","Moving to Arizona Soon? You Might Need a License","Horse Rub? Where’s Your License?","Business Day","2016-06-18 00:00:00"
"39958","Viacom Director Has Uphill Battle in Case Against Redstone",NA,"Business Day","2016-06-18 00:00:00"
"39964","A Hacking of More Than $50 Million Dashes Hopes in the World of Virtual Currency","$50 Million Hacking May Scuttle a Virtual Currency Project","Business Day","2016-06-18 00:00:00"
"39975","Who Owns the Copyright to ‘This Land Is Your Land’? It May Be You and Me",NA,"Business Day","2016-06-18 00:00:00"
"40140","Gender Diversity on Corporate Boards","Gender Diversity on Corporate Boards","Business Day","2016-06-19 00:00:00"
"40144","Raghuram Rajan Says He’ll Step Down as Head of India’s Central Bank","India’s Central Bank Chief, Object of Praise and Scorn, to Step Down","Business Day","2016-06-19 00:00:00"
"40150","Quiz: Barriers to Work ",NA,"Business Day","2016-06-19 00:00:00"
"40151","After 147 Years, Goldman Sachs Hangs a Shingle on Main Street","Goldman Sachs Says $1 Is Enough","Business Day","2016-06-19 00:00:00"
"40176","Beth Comstock of General Electric: Granting Permission to Innovate","Granting Permission to Innovate","Business Day","2016-06-19 00:00:00"
"40178","An Expensive Law Degree, and No Place to Use It","The Law School Bust","Business Day","2016-06-19 00:00:00"
"40186","With Organic Cotton and Online Ads, Boll &amp; Branch Helps Indian Farmers","Sourcing Organic Cotton From India, for a Cause","Business Day","2016-06-19 00:00:00"
"40295","Mike Allen, Politico’s Newsletter Pioneer, Is Handing Over the Reins","Newsletter Pioneer  at Politico  Will Pass the Baton Midyear","Business Day","2016-06-20 01:14:48"
"40330","Two Abu Dhabi Banks Confirm Discussions on a Merger","Two Abu Dhabi Banks Confirm Discussions on a Merger","Business Day","2016-06-20 00:00:00"
"40334","Reckoning Near for Merger of Energy Transfer and Williams","Reckoning Nears for Merger of Energy Transfer and Williams","Business Day","2016-06-20 00:00:00"
"40339","Tribune Publishing’s New Name, ‘tronc,’ Puzzles Marketing Experts","Tribune Publishing’s New Name, ‘tronc,’ Puzzles Marketing Experts","Business Day","2016-06-20 00:00:00"
"40355","Treasury Auctions Set for the Week of June 20","Treasury Auctions Set for This Week","Business Day","2016-06-20 00:00:00"
"40359","Health Insurer Hoped to Disrupt the Industry, but Struggles in State Marketplaces","Start-Ups Struggle  to Insure Individuals","Business Day","2016-06-20 00:00:00"
"40381","A Need to Adapt and to Anticipate Change","Beyond Tradition: A Need to Adapt and to Anticipate Change","Business Day","2016-06-20 12:30:00"
"40386","Documents on For-Profit Corinthian Colleges",NA,"Business Day","2016-06-21 00:00:00"
"40391","Jack Fuller, 69, Chicago Tribune Journalist Who Led Expansion, Dies","Jack Fuller, 69, Prizewinning Chicago Journalist, Dies","Business Day","2016-06-21 21:11:19"
"40413","A New District for Garments",NA,"Business Day","2016-06-21 00:00:00"
"40484","Why Uber Keeps Raising Billions","To Mark  Its Territory,  Uber Fattens Its Bankroll","Business Day","2016-06-21 00:00:00"
"40494","Credit Suisse Chief Contends With Rising Tensions, and a Sinking Stock","Credit Suisse Chief Contends With Rising Tensions, and a Sinking Stock","Business Day","2016-06-21 00:00:00"
"40497","Walmart Sells E-Commerce Site in China, Forging Strategic Alliance","To Gain Ally, Walmart Sells Site in China","Business Day","2016-06-21 00:00:00"
"40503","Jeep That Crushed Anton Yelchin Had Been Recalled","Jeep That Crushed Actor  Had Already Been Recalled","Business Day","2016-06-21 00:00:00"
"40504","Supreme Court Sides With R.J. Reynolds in RICO Case","Supreme Court Sides With Tobacco Company in RICO Case","Business Day","2016-06-21 00:00:00"
"40509","Game 7 of N.B.A. Finals Draws Close to 31 Million Viewers",NA,"Business Day","2016-06-21 00:00:00"
"40528","Craft Beer and USB Ports: Airlines Upgrade Clubs to Lure Customers","Airlines Upgrade Clubs to Lure High-End Customers","Business Day","2016-06-21 00:00:00"
"40542","Message to Workers Under Scrutiny: Cooperate or Get Fired",NA,"Business Day","2016-06-21 00:00:00"
"40546","Elliott and Private Equity Firm to Buy Dell’s Software Unit",NA,"Business Day","2016-06-21 00:00:00"
"40547","As Fears of Brexit Ease, Wall Street Thrives","As Fears of Brexit Ease, Wall St. Thrives","Business Day","2016-06-21 00:00:00"
"40550","Martin Winterkorn, Ex-C.E.O. of Volkswagen, Is Under Investigation","VW’s Ex-Chief Under Scrutiny for Timing of Disclosure","Business Day","2016-06-21 00:00:00"
"40575","Robert Cox, Man Behind the ‘Just Say No’ Antidrug Campaign, Dies at 78","Robert Cox, 78, an Ad Man Who Gave Nancy Reagan a Comeback for Drug Use","Business Day","2016-06-22 23:33:20"
"40677","David T. Morgenthaler, Who Shaped Venture Capitalism, Dies at 96","David Morgenthaler, 96, Venture Capitalist","Business Day","2016-06-22 00:13:42"
"40707","Anton Yelchin’s Death Highlights a Known Issue With Jeeps","The Death of an Actor Highlights a Jeep Issue","Business Day","2016-06-22 00:00:00"
"40710","Elon Musk Aims to Shore Up SolarCity by Having Tesla Buy It","Musk Aims to Shore Up SolarCity  by Buying It","Business Day","2016-06-22 00:00:00"
"40712","Energy Transfer Shares Surge During Merger Trial With Williams","Energy Transfer Shares Surge After Comments During Merger Trial With Williams","Business Day","2016-06-22 00:00:00"
"40733","Judge Allows Lawsuit Claiming Starbucks Underfills Lattes",NA,"Business Day","2016-06-22 00:00:00"
"40738","Law School a Solid Investment, Despite Pay Discrepancies","Law School a Solid Investment, Despite Pay Discrepancies","Business Day","2016-06-22 00:00:00"
"40742","A Departure Leaves SoftBank’s Founder Firmly in Charge",NA,"Business Day","2016-06-22 00:00:00"
"40754","Goodbye, Password. Banks Opt to Scan Fingers and Faces Instead.","Bye, Password. Now a Fingertip Gets Clients In.","Business Day","2016-06-22 00:00:00"
"40760","The Moody’s Economic Report That Clinton Is Using to Attack Trump",NA,"Business Day","2016-06-22 00:00:00"
"40768","At Disney, Gloomy Realities Shadow a Fantasy World","When Gloomy Realities Encroach on ‘the Happiest Place on Earth’","Business Day","2016-06-22 00:00:00"
"40770","Hedge Fund Manager Charged With Insider Trading Is Found Dead","Fund Manager Facing Charges Is Found Dead at Home","Business Day","2016-06-22 00:00:00"
"40775","Testimony by Yellen Nudges the Market Higher","Testimony by Yellen Nudges the Market Higher","Business Day","2016-06-22 00:00:00"
"40776","Janet Yellen Hints That Fed May Hold Back on Raising Interest Rates","Growth Weak, Fed Chairwoman Signals No Hurry to Raise Interest Rates","Business Day","2016-06-22 00:00:00"
"40777","Why You Probably Won’t Get to Use Your Ticketmaster Vouchers",NA,"Business Day","2016-06-22 00:00:00"
"40779","A Conversation With Cablevision’s New Owner","Cablevision’s New Owner Talks About Goals for the Future","Business Day","2016-06-22 00:00:00"
"40781","California’s Last Nuclear Power Plant Could Close","California’s Last Nuclear Power Plant  Could Be Replaced With Clean Energy","Business Day","2016-06-22 00:00:00"
"40782","E.U. Countries Tighten Rules to Counter Tax Avoidance",NA,"Business Day","2016-06-22 00:00:00"
"40784","SoftBank President Nikesh Arora Plans to Step Down","A Noted Silicon Valley Star  Leaves SoftBank of Japan","Business Day","2016-06-22 00:00:00"
"40789","After Brexit Vote, a Choice for Europe: Move Forward, or Fall Back","After ‘Brexit’ Vote, Europe Has Choice","Business Day","2016-06-22 00:00:00"
"40811","Fallout From Britain’s Exit: Markets, Immigration and Trade",NA,"Business Day","2016-06-23 00:00:00"
"40829","Bank Report Card: Part One",NA,"Business Day","2016-06-23 00:00:00"
"40837","Jeff Gennette to Succeed Terry Lundgren as Macy’s Chief","Macy’s Chief Will Step Down in 2017, to Be Succeeded by Its President","Business Day","2016-06-23 16:17:13"
"40842","Britain’s Dreams of a ‘Swiss Miracle’ Look More Like Fantasy","Britain’s Fantasy of a ‘Swiss Miracle’","Business Day","2016-06-23 15:39:29"
"40885","A Strategy Session With Some of Education’s Top Thinkers","A Strategy Session With Some of Education’s Top Thinkers","Business Day","2016-06-23 05:08:12"
"40940","Grand Cherokee Product Placement Becomes Awkward for Fox","Grand Cherokee Product Placement  Becomes Awkward Situation for Fox","Business Day","2016-06-23 00:00:00"
"40941","Twilio I.P.O. Raises $150 Million",NA,"Business Day","2016-06-23 00:00:00"
"40942","Fiat Chrysler Moves Up Gearshift Repairs After Death of Anton Yelchin","Fiat Chrysler Speeds Up a Fix for Jeeps After Actor’s Death","Business Day","2016-06-23 00:00:00"
"40958","‘Brexit’ Vote Already Has a Winner: The Gambling Industry","A Winner in the ‘Brexit’ Vote: Britain’s Gambling Industry","Business Day","2016-06-23 00:00:00"
"40964","On Capitol Hill, Yellen Finds Partisan Heat, Not Economic Light","On Capitol Hill, Partisan Heat, Not Economic Light","Business Day","2016-06-23 00:00:00"
"40972","HBO Unexpectedly Cancels Low-Rated ‘Vinyl’ After One Season","HBO Cancels Low-Rated ‘Vinyl’ After First Season","Business Day","2016-06-23 00:00:00"
"40974","Existing-Home Sales Surged in May, Reaching 9-Year High","Sales of Existing Homes Surged in May","Business Day","2016-06-23 00:00:00"
"40980","Facebook Shareholder Vote Produces Odd Results",NA,"Business Day","2016-06-23 00:00:00"
"40986","Tesla’s Plan to Buy SolarCity Has Major Flaws",NA,"Business Day","2016-06-23 00:00:00"
"40990","Veterans Use Battlefield Experiences to Build Businesses","Some Entrepreneurial Veterans Go From Battlefield to Boardroom","Business Day","2016-06-23 00:00:00"
"40993","New Ways to Treat Pain Meet Resistance","Treating Pain Without Drugs","Business Day","2016-06-23 00:00:00"
"40998","Mitsubishi Predicts $1.39 Billion Loss After Fuel Economy Fraud","Mitsubishi Predicts Loss  After Fuel Economy Fraud","Business Day","2016-06-23 00:00:00"
"41004","Corinthian Colleges Used Recruiting Incentives, Documents Show","Documents Link Defunct College Chain to Recruiting Violations","Business Day","2016-06-23 00:00:00"
"41008","Modest Loss for the Market Ahead of British Vote","Shares Fall on Energy and Tech Troubles","Business Day","2016-06-23 00:00:00"
"41011","Qatari Investment Group Acquires Parisian Fashion House Balmain","Qatari Investment Group Acquires the Parisian Fashion House Balmain","Business Day","2016-06-23 00:00:00"
"41023","Former Bangladesh Bank Chief Blames Global System for Theft","Ex-Bangladesh Bank Chief Blames Global Transfer System for Theft","Business Day","2016-06-23 00:00:00"
"41026","VW Shareholders Vent: ‘They Have Been Rewarded for Failure.’","Volkswagen Has Been ‘Rewarded for Failure,’ Shareholders Say at Meeting","Business Day","2016-06-23 00:00:00"
"41043","Private Equity and Housing",NA,"Business Day","2016-06-24 00:00:00"
"41046","‘Brexit’ Talk on Social Media Favored the ‘Leave’ Side","‘Leave’ Talk Prevailed on Facebook ‘Brexit’ Sites","Business Day","2016-06-24 23:54:48"
"41053","Energy Transfer Wins Ruling on Escaping Williams Deal","Energy Transfer Wins Ruling on Escaping Williams Deal","Business Day","2016-06-24 21:33:48"
"41055","Some Early Signs of ‘Brexit’ Upheaval","Points of Departure","Business Day","2016-06-24 21:14:47"
"41089","Countrywide Mortgage Devastation Lingers as Ex-Chief Moves On","Time Doesn’t Heal Wounds of Bad Loans","Business Day","2016-06-24 17:36:16"
"41097","South Korean Court Orders Arrest of VW Official Over Emissions Cheating","South Korea Court Orders Arrest of a VW Executive","Business Day","2016-06-24 16:49:16"
"41150","Lisa Gersh of Goop: Treat Meetings Like Improv Sessions","Treat Meetings Like Improv Sessions","Business Day","2016-06-24 11:00:16"
"41220","For Chuck Taylor, a Sole Trademark Is Upheld","For Chuck Taylor, Sole  Trademark Is Upheld","Business Day","2016-06-24 00:00:00"
"41233","Costco’s Transition to Visa Cards Riddled With Problems","Transition  to Visa  at Costco Is Chaotic","Business Day","2016-06-24 00:00:00"
"41237","YouTube Red Buys ‘Step Up,’ Its First Big-Budget TV Drama","YouTube  Acquires a Scripted TV Series","Business Day","2016-06-24 00:00:00"
"41250","Goldman Sachs Uses Video to Cast Wider Net for Young Bankers",NA,"Business Day","2016-06-24 00:00:00"
"41251","A Russian Oil Company Is for Sale — Again","A Russian Fire Sale","Business Day","2016-06-24 00:00:00"
"41279","Nation’s Biggest Banks Would All Withstand Recession, Fed Says","Fed Says Big Banks Can Endure a Recession","Business Day","2016-06-24 00:00:00"
"41291","Dior Is Expected to Name Maria Grazia Chiuri as Artistic Director","Half of a Vaunted Valentino Design Team Is Said to Be Moving to Dior","Business Day","2016-06-24 00:00:00"
"41292","Bank of America to Pay $415 Million to Settle S.E.C. Inquiry","Bank of America Settles S.E.C. Inquiry for $415 Million","Business Day","2016-06-24 00:00:00"
"41296","Led Zeppelin Did Not Steal ‘Stairway to Heaven,’ Jury Says","Zeppelin Riff on ‘Stairway’ Is an Original","Business Day","2016-06-24 00:00:00"
"41309","Testing the Clean-Energy Logic of a Tesla-SolarCity Merger","Tesla-SolarCity Merger Is a Vehicle for a Vision","Business Day","2016-06-24 00:00:00"
"41320","Bank of America Merrill Lynch Hires Chief of European Mergers",NA,"Business Day","2016-06-24 00:00:00"
"41322","Twilio, a Cloud-Based Business, Soars After Its I.P.O.",NA,"Business Day","2016-06-24 00:00:00"
"41323","Credit Suisse Tries to Overhaul Its Image, but Problems Remain",NA,"Business Day","2016-06-24 00:00:00"
"41335","Wall St. Rises as a ‘Brexit’ Appears Less Likely","U.S. Market Rises as Britons Vote","Business Day","2016-06-24 00:00:00"
"41338","Maserati Recalls 13,000 Cars for Fiat Chrysler Gearshift Issue","Fiat Chrysler Gearshift Issue Affects Some Maseratis","Business Day","2016-06-24 00:00:00"
"41342","Cerberus Offers to Buy G.E.’s French Consumer Finance Business",NA,"Business Day","2016-06-24 00:00:00"
"41363","Clearing the Way for a Railroad",NA,"Business Day","2016-06-25 00:00:00"
"41364","Private Equity Investment in Urban Areas",NA,"Business Day","2016-06-25 00:00:00"
"41413","At King Arthur Flour, Savoring the Perks of Employee Ownership","Workers Acting Like They Own the Place? They Might.","Business Day","2016-06-25 15:43:32"
"41416","Billionaire Lists Are Battling to Feed a Hunger for Rankings","The Battle of the Billionaire Lists","Business Day","2016-06-25 15:38:18"
"41417","In Search of the Felon-Friendly Workplace","In Search of the Felon-Friendly Workplace","Business Day","2016-06-25 15:34:32"
"41422","‘Brexit’ in America: A Warning Shot Against Globalization","‘Brexit’ in America","Business Day","2016-06-25 12:32:52"
"41424","When You Dial 911 and Wall Street Answers","When You Dial 911  and Wall St. Answers","Business Day","2016-06-25 11:51:13"
"41440","Bending Elbows After ‘Brexit’",NA,"Business Day","2016-06-25 00:54:40"
"41484","Hearing Shows Little Is Known on Who Controls Viacom",NA,"Business Day","2016-06-25 00:00:00"
"41517","The Psychological Impact of Britain’s Vote",NA,"Business Day","2016-06-25 00:00:00"
"41539","Turbulence and Uncertainty for the Market After ‘Brexit’","Turbulence, and a Lot of Uncertainty, for Investors as the Global Market Wobbles","Business Day","2016-06-25 00:00:00"
"41711","Lawyers in a Lurch","Comments; Lawyers in a Lurch","Business Day","2016-06-26 00:00:00"
"41715","What Can Go Wrong When Private Equity Takes Over a Public Service",NA,"Business Day","2016-06-26 00:00:00"
"41716","A Primer on Private Equity",NA,"Business Day","2016-06-26 00:00:00"
"41832","How Housing’s New Players Spiraled Into Banks’ Old Mistakes","Private Equity Hits Close to Home","Business Day","2016-06-27 00:46:00"
"41833","At Cannes, the Ad Industry Confronts the Rise of Facebook","Ad Industry Confronts the Rise  of Facebook","Business Day","2016-06-27 00:27:34"
"41868","Collecting Fees Whether You Stay or Go",NA,"Business Day","2016-06-27 00:00:00"
"41871","After ‘Brexit,’ a Splitting Hangover for the City of London","Fazed in the City of London","Business Day","2016-06-27 00:00:00"
"41887","Buy Yourself an Interview","Buy Yourself an Interview, for the Public or Posterity","Business Day","2016-06-27 00:00:00"
"41889","Study Links 6.5 Million Deaths Each Year to Air Pollution","Study Links Air Pollution to Over 6 Million Deaths","Business Day","2016-06-27 00:00:00"
"41891","Central Banks Worry About Engaging World Markets After ‘Brexit’","Central Banks Wary of Engaging World Markets After ‘Brexit’","Business Day","2016-06-27 00:00:00"
"41898","Perdue Aims to Make Chickens Happier and More Comfortable","Giving Chickens More Time to Peck and Play in the Sunshine","Business Day","2016-06-27 00:00:00"
"41902","Volkswagen Faces Long Road Ahead, Even After a Civil Settlement","Volkswagen Faces a Long Legal Road","Business Day","2016-06-27 00:00:00"
"41908","Intel Tells Stories That Go Beyond Chips","With Its Own Inside Agency, Intel Tells Stories That Go Beyond Chips","Business Day","2016-06-27 00:00:00"
"41909","Treasury Auctions Set for the Week of June 25","Treasury Auctions Set for This Week","Business Day","2016-06-27 00:00:00"
"41911","‘Brexit’ Surprised Hedge Fund Managers Used to Picking Winners","‘Brexit’ Surprised Hedge Fund Managers Used to Picking Winners","Business Day","2016-06-27 00:00:00"
"41928","A Promising Athens Arts Complex",NA,"Business Day","2016-06-28 00:00:00"
"41938","James Green, Author and Human Rights Activist, Dies at 71","James Green, Human Rights Activist, Dies at 71","Business Day","2016-06-28 22:05:51"
"42046","Justices Decline to Hear Case Limiting Debt Collectors","Justices Decline Case Limiting Debt Collectors","Business Day","2016-06-28 00:00:00"
"42048","What the Volkswagen Settlement Could Mean for Car Owners","How Settlement May Affect Car Owners","Business Day","2016-06-28 00:00:00"
"42051","A Single Senator Stymies the Export-Import Bank","Inflexibility of Senator Stymies Ex-Im Bank","Business Day","2016-06-28 00:00:00"
"42054","Volkswagen to Pay $14.7 Billion to Settle Diesel Claims in U.S.","VW Will Pay $14.7 Billion in Diesel Case","Business Day","2016-06-28 00:00:00"
"42059","Williams Appeals Delaware Decision to End Pipeline Merger","Williams Cos. Appeals a Ruling  That Lets a Deal Be Terminated","Business Day","2016-06-28 00:00:00"
"42068","AstraZeneca Pushes to Protect Crestor From Generic Competition","A Fight to Fend Off Generics","Business Day","2016-06-28 00:00:00"
"42075","Bad Behavior Is Exposed as the Shale-Oil Market Shrinks",NA,"Business Day","2016-06-28 00:00:00"
"42078","World’s Largest Uncut Diamond Heads to Auction, a Break With Tradition","Diamond in the Rough (It’s the World’s Biggest) Looks for a Rich Bidder","Business Day","2016-06-28 00:00:00"
"42080","Obama White House Veterans Gleefully Enter the Podcast World",NA,"Business Day","2016-06-28 00:00:00"
"42090","Spirit Airlines Wants to Stay Cheap but Not So Tawdry","Spirit Airlines Wants to Be Just Cheap, Not Tawdry","Business Day","2016-06-28 00:00:00"
"42091","RJR Nabisco Ruling Bolsters Justice Dept.’s Pursuit of FIFA",NA,"Business Day","2016-06-28 00:00:00"
